patronmanager,PatronManager is a comprehensive CRM that lacks the ease of use that comparable programs have.,Verified Reviewer,nan,11-50 employees,Source: Capterra,NGC,nan,"Jun 30, 2018",3,3,3,3,3,5.0,"Comments: The Townsend Center for the Performing Arts is now in its second season with PatronManager. The system is built on the SalesForce Platform, which is the leading CRM and database platform used by most of the Fortune 500 companies.","Pros: The CRM function is a great tool. The program holds all customer data and is organized by contacts, households, etc. Users can easily search by any aspect of the customer account (name, email, phone, etc). The multiple reporting features are also very useful.","Cons: It is extremely frustrating that there is not an option to automatically connect online orders to an existing account. Instead, all orders must be qualified on the backend, which is an astoundingly time consuming and mundane process. For such a popular system, it is surprising that this issue persists. Additionally, the ticket sales function is not very user friendly and is extremely slow to complete. Each transaction requires multiple pages, and the web browser automatically reloads whenever a selection is changed. In addition, email addresses are required to make a sale, and the only way to get around this is very clunky and time consuming.",Overall: It is a great way to store all customer data in a comprehensive CRM.,
patronmanager,Patron Manager,Verified Reviewer,nan,"Consumer Goods, 51-200 employees",Source: Capterra,NGC,nan,"Aug 09, 2018",5,4,4,nan,5,9.0,"Comments: The Townsend Center for the Performing Arts is now in its second season with PatronManager. The system is built on the SalesForce Platform, which is the leading CRM and database platform used by most of the Fortune 500 companies.",Pros: Being able to have a CRM service for the company - there's a lot one can do with this.,Cons: The time it takes to learn various aspects of it.,Overall: It is a great way to store all customer data in a comprehensive CRM.,
patronmanager,Switched to Patron Manager from SeatAdvisor,Steve I.,Co-Producer/Box Office Mgr,"Performing Arts, 201-500 employees",Used the software for: Less than 6 months,NGC,Source: Capterra,"Aug 09, 2018",5,5,5,5,5,10.0,"Comments: The Townsend Center for the Performing Arts is now in its second season with PatronManager. The system is built on the SalesForce Platform, which is the leading CRM and database platform used by most of the Fortune 500 companies.","Pros: Fast, powerful, great support, easy to use","Cons: nothing at all. This system, on the Salesforce database is wonderful","Overall: Switched from SeatAdvisor to PatronManager in June (started in March 2018 for the conversion). The level of caring, support, and knowledge is unsurpassed. They listened and helped me use the system the way we do our business.",
patronmanager,"My theater uses Patron Manager, it is easy to train on with our staff changeover",Verified Reviewer,nan,Performing Arts,Source: Capterra,NGC,nan,"Jun 15, 2018",4,5,4,4,nan,7.0,"Comments: The Townsend Center for the Performing Arts is now in its second season with PatronManager. The system is built on the SalesForce Platform, which is the leading CRM and database platform used by most of the Fortune 500 companies.","Pros: Patron manager makes for easy training. We have a new staff every summer, mostly college age people and it's got to be something that is straightforward, simple, and easy to retrain and reteach. They do well every year with it.","Cons: Occasionally, we have some troubleshooting issues with making edits. Usually, we can get the issues resolved via customer service or google though.","Overall: Switched from SeatAdvisor to PatronManager in June (started in March 2018 for the conversion). The level of caring, support, and knowledge is unsurpassed. They listened and helped me use the system the way we do our business.",
patronmanager,"Customizeable, lots of features on admin side",Box Office M.,,,,nan,Source: Capterra,"Apr 28, 2016",5,4,nan,5,nan,nan,"Comments: Runs on Salesforce platform. PatronManager / PatronTicket has so much customization and programming capabilities. Easy to train staff for simple sales and ticketing, as well.","Pros: Patron manager makes for easy training. We have a new staff every summer, mostly college age people and it's got to be something that is straightforward, simple, and easy to retrain and reteach. They do well every year with it.","Cons: Occasionally, we have some troubleshooting issues with making edits. Usually, we can get the issues resolved via customer service or google though.","Overall: Switched from SeatAdvisor to PatronManager in June (started in March 2018 for the conversion). The level of caring, support, and knowledge is unsurpassed. They listened and helped me use the system the way we do our business.",
patronmanager,Beware,Ben T.,Executive Director,,,nan,Source: Capterra,"May 05, 2016",1,1,nan,1,nan,nan,"Comments: We discussed several things with Patron Manager prior to signing a contract. One of those things was dynamic pricing. PM said they could handle this type of pricing and never once mentioned an added fee was even a possibility. Several weeks after signing a contract, PM informed us that we'd need to pay an additional fee to use these tools. When we asked to back out of the agreement, PM allowed us to, but did not return our full set-up fee -- unethical at best. I would not recommend PM.","Pros: Patron manager makes for easy training. We have a new staff every summer, mostly college age people and it's got to be something that is straightforward, simple, and easy to retrain and reteach. They do well every year with it.","Cons: Occasionally, we have some troubleshooting issues with making edits. Usually, we can get the issues resolved via customer service or google though.","Overall: Switched from SeatAdvisor to PatronManager in June (started in March 2018 for the conversion). The level of caring, support, and knowledge is unsurpassed. They listened and helped me use the system the way we do our business.",
