silent_auction_pro,"Great Overall, Raised our amount earned this year",Molly C.,Director of Events,"Education Management, 51-200 employees",Used the software for: 1-2 years,NO,Source: Capterra,30-May-17,4,4,4,4,4,8,,Pros: I like the fact that the software texts or emails you when you have been outbid and that you can pre-schedule texts to go out to all the users on the day of your event.,"Cons: In conjunction with the Pros, I dislike the fact that sometimes the system can get a glitch and the texts that get set up ahead of time do not get sent out even though you set them up correctly. Even with this, I'd use the group again.",Overall: We raised the amount of money overall on our net!,
silent_auction_pro,New to Online Auctions,Kristin E.,Director,"Education Management, 11-50 employees",Used the software for: Less than 6 months,NO,Source: Capterra,21-Jun-16,5,4,5,5,5,8,,"Pros: The customer service was really great. I probably had a billion questions and their ""Help"" information and videos online answered most of them, but I had a couple of extra ones I needed support on. The team was really great, supportive and answered all of my questions. Another ""pro"" was earning extra money, going online really worked!","Cons: I wish the software was a little more intuitive, it was a bit of a learning curve for me. But honestly, I know there is so much going on behind the scenes, a software would have to read my mind for me to really understand it! I also wish we didn't have to get a merchant account. I knew I wouldn't use it and it was a lot of extra steps (and stress) for something that didn't impact my system.","Overall: We've only been hosting an Auction for our preschool for a few years, but wanted to try out the online option. Silent Auction Pro seemed like a good fit for our process so we gave them a try. Our event was more successful than in previous years, we raised 22% more than last year, which was super great. The staff at Silent Auction Pro were very helpful and very present. It was easy to get the support I needed!",
silent_auction_pro,We love Silent Auction Pro,Tricia H.,Coordinator of Enrollment & Special Events,"Education Management, 51-200 employees",Used the software for: 2+ years,NO,Source: Capterra,18-Mar-19,5,5,5,5,5,9,,Pros: I love the fact that we can sell tickets and sponsorship's & have our silent auction all on the same system!,"Cons: Not too much I don't like! If I could change something, I would ask to assign my own bidder numbers based on the ticket sales :).","Overall: Overall experience is great! This was year 2 of using this program and I only had to make 2 phones to the company and it was for general information, no problems!",
silent_auction_pro,President,William S.,President,"Education Management, 201-500 employees",Used the software for: 1-2 years,NO,Source: Capterra,25-Mar-19,5,4,5,5,5,10,,"Pros: This software essentially removed our need to hire an auction company to handle our event - saving us upwards of $2,500.","Cons: The software could use a little more ""what you see is what you get"" buttons - in other words, navigation for dummies; but if you spend even a little time using the software, it's intuitive and grows on you quickly.",Overall: From the owner (who calls you back immediately) to the support person (who you can call at 11:00pm during your checkout on the Saturday night of the event) - it's the type of customer service that is rare these days - bravo to the team!!,
silent_auction_pro,Great & I hope to be able to use the software again next year for our event!,Tara R.,Fundraising & Logistics Assistant,,Used the software for: Less than 6 months,NO,Source: Capterra,17-Nov-17,5,4,4,5,5,10,,"Pros: The customer service rep assigned to my case was FANTASTIC. In fact, she reached out to me more than I had to reach out to her. Whether I had a quick easy question or a BIG confusing question, I also felt more confident after talking to her.","Cons: The only drawback, and it isn't even really a drawback, is that the software can do SO much that I didn't even take advantage of. I am hoping that after learning the basics this time around, I can dig a little deeper next year and use more of the reports and functions that are available to me.",Overall: Safe & secure place to store and update contact information. Easy reports. Easy bid sheets. Streamlined check in and check out process.,
silent_auction_pro,Excellent Product,Verified Reviewer,Fundraising & Logistics Assistant,"Education Management, 11-50 employees",Source: Capterra,NO,Source: Capterra,9-May-19,5,5,5,5,3,10,,Pros: Silent Auction Pro is effective and user friendly. We like that it is web-based and tailored well to fundraising. We appreciate their prompt response whenever help is needed. The company is easy to work with - by phone or email. We appreciated their email reminders throughout the planning process.,Cons: Would like to have access to all Silent Auction reports indefinitely.,Overall: We are a nonprofit. Silent Auction was an excellent tool for our largest annual fundraiser. Helped us to organize an event with over 250 attendees. Appreciate their timely responses throughout the process and their support team.,
silent_auction_pro,Favorite Auction Software,Evan G.,Membership Manager,,,NO,Source: Capterra,17-Mar-16,5,5,5,5,3,10,"Comments: Greetings,I have used Silent Auction Pro for 5 years. It is truly the ideal auction software for non-profit and charity auctions. With over 200 items being donated, it becomes challenging to manage these items in Microsoft Excel - but Silent Auction Pro makes it easy to manage it all. The software manages auction donations, tickets, seating arrangements, and acknowledgements. I have used other auction software and this is by far my favorite. The credit card processing was secure, and went through Element Payment Services.",,,,
silent_auction_pro,Highly Recommended,Gail G.,President,"Individual & Family Services, 1-10 employees",Used the software for: 6-12 months,NO,Source: Capterra,12-Jun-19,5,4,4,5,5,10,,Pros: The software is easy to use and fairly user friendly. Working directly with the company made the process pretty seamless.,Cons: The real negative for us was having to enter silent auction donations and ticket sales in the same area. We feel that being able to enter these items in two separate areas would be much less confusing and make for better reporting at the end.,Overall: Silent Auction Pro's price cannot be beat and their support was exceptional. They were always available to answer questions and solve any problems. We have used them for 3 events thus far this year and are gearing up for two more in a few months. We are extremely happy with our decision to switch to Silent Auction Pro.,
silent_auction_pro,Supportive & User Friendly Event Software,Melissa A.,President,"Non-Profit Organization Management, 11-50 employees",Used the software for: Less than 6 months,NO,Source: Capterra,28-Apr-19,5,4,4,5,5,10,,"Pros: The staff was there EVERY step of the way. Our salesperson checked in regularly to make sure we knew what we were doing, gave helpful tips and pointers and offered to assist with each stage. In addition, when we stumbled a bit the night of the event-the support team was there to talk us through every step until our event closed at midnight.In addition, the software was user friendly and reasonably easy to navigate.","Cons: I would like there to be a search field, for when having difficulty figuring something out.","Overall: Overall, we had an excellent experience due to the constant support of the staff at Silent Auction Pro. At any moment of frustration in learning the product, a staff member was there to assist.",
silent_auction_pro,Used SAP Since 2016,Amy P.,Trivia Night,"Non-Profit Organization Management, 1-10 employees",Used the software for: 2+ years,NO,Source: Capterra,5-Mar-19,5,5,5,5,5,10,,Pros: It's easy to use even if you have zero background in fundraising and auctions! Technical support is always helpful and friendly. They go out of their way to help you!,"Cons: Having to deal with PayPal. While SAP has amazing customer service, PayPal sadly does not. It would be great to only have to deal with SAP.",,
silent_auction_pro,A terrific first time experience,Seth M.,Executive Director,"Non-Profit Organization Management, 1-10 employees",Used the software for: Less than 6 months,NO,Source: Capterra,5-Jun-17,5,4,5,5,5,10,,"Pros: Silent Auction Pro was a fantastic tool for us for our first online silent auction. It had enough flexibility to allow us to manage our unique online only use, it was fairly straightforward, and we didn't have a single bidder complaint about access. Our event went very smoothly!","Cons:The software wasn't always intuitive, so we ended up calling support a number of times. Often the answer was on the help page and we were either too lazy to find it, or didn't use the right search terms. That said, the support team was very quick to respond to our emails and calls, and very helpful.",,
silent_auction_pro,The best software support I have experienced. That is essential to us!,Debbie W.,Auction Committee Chair,"Civic & Social Organization, 51-200 employees",Used the software for: 1-2 years,NO,Source: Capterra,5-Nov-17,5,4,4,5,5,10,,Pros: You can reach a real person who is competent in the software in a timely fashion. Supportive calls and emails that are informative and timely. An easy and efficient help menu.,Cons: It has taken some time and experience to understand all the features that are available and just how to make them work for us.,"Overall: It helped us increase our event audience and proceeds. It has saved us a great deal of time and frustration in trying to organize, track, save and report all the information essential to a successful auction.",
silent_auction_pro,Make your silent auction so much more successful.,Kim M.,Director,"Education Management, 51-200 employees",Used the software for: 2+ years,NO,Source: Capterra,20-Jun-16,5,4,5,5,5,10,,Pros: Ability to see which areas brought in the most profit and the checkout system the night of the event.,"Cons: Would like to be ableTo delete old contacts from current contacts/donors. Ability to clean up the donor list.",Overall: We loved using this software. Each year we have added more and more options. Once learned the system is so helpful and easy to use.,
silent_auction_pro,Suits our needs to a T!,John D.,Director of Communications & Community Relations,"Non-Profit Organization Management, 51-200 employees",Used the software for: 2+ years,NO,Source: Capterra,1-Sep-16,5,5,5,5,5,10,,Pros: Ease of use and reliability.,,Overall: We run a few major fund raising events each year and were looking for a user friendly solution that would assist us with attendee registration and donor management. We have found Silent Auction Pro to fit that need. Their support team is very responsive and a pleasure to deal with.,Recommendations to other buyers: Utilize their support team. All seem very knowledgable and anxious to accommodate needs.
silent_auction_pro,The customer support is unparalleled!,Susan D.,"Owner, Speaker, Author",,Used the software for: 2+ years,NO,Source: Capterra,28-Oct-17,5,5,4,5,5,10,,Pros: The Customer Support is very helpful. We had not used a formal database previously and have found this one to be very easy to use.,Cons: I wish we could link two bidders (spouses) so we know if both have used the bid # upon checkout. Would love to have a couple more checks and balances in place.,,
silent_auction_pro,Silent Auction Pro,Anne C.,Executive Assistant,201-500 employees,Used the software for: 6-12 months,NGC,Source: Software Advice,20-Jul-18,5,5,5,5,5,10,,Pros: I like how I customized my activities and be transparent in my log. It kept me organized on my work.,Cons: Maybe just try to improve on how letters to be formatted. And some problem in downloading excel file.,,
silent_auction_pro,Deschutes Family Recovery: 3rd Annual Helping Hands Gala,Helen F.,,"Non-Profit Organization Management, 1-10 employees",Used the software for: 6-12 months,NGC,Source: Capterra,20-Jun-16,4,4,4,5,5,10,,"Pros: Ability to enter, track, and package donations. After event reports (which categories of donations returned the highest proceeds, accounting, etc.) offered a lot more information than we had anticipated and has proved to be one of the most valuable features for our group.","Cons: We found the table assignments feature was challenging to use. Also it would have been able to separate admission tickets from other types of tickets sold (i.e. raffle tickets) in the ticket reports. The system recommended entering couples as individuals, this also proved to create problems for us when assigning tables and during the check-in/check-out process.","Overall: After vetting a few other products similar to Silent Auction Pro, we opted to use SAP for our 3rd Annual Event. The price of SAP was considerably less than other products and the features comparable. Customer service was top notch! We had relied on spreadsheets for our prior 2 events and SAP saved an enormous amount of staff time before, during, and after the event.",
silent_auction_pro,Great software that is invaluable aid to fundraising,Rich J.,President,,Used the software for: 1-2 years,NO,Source: Capterra,23-Feb-18,5,3,5,5,5,10,,"Pros: Functionality is excellent. It has lots of features and benefits. The administration and reporting tools are also well thought out. It is clear they understand the many requirements of fundraising.Finally, their support is outstanding.","Cons: It takes a while to learn the navigation- where tools are located. Also, in one or two instances we wanted to extract information in a certain way but the system didn't provide for this.",,
silent_auction_pro,Solving all problems for our Foundation,Louis V.,Marketing Coordinator,"Non-Profit Organization Management, Self-employed",Used the software for: Less than 6 months,NO,Source: Capterra,19-Apr-17,5,5,5,5,5,10,,Pros: Checking in and out for all attendees. High use of Bidding and reporting. Ease of use entering donations and creating Auction items.,Cons: There was nothing that I disliked about this product except that it would need the ability to have multi winners.,"Overall: The main problem we were trying to resolve was the Check-in process and checkout process. Both were easily to resolved with Silent Auction Pro (SAP). Another common issue we had was the ability to grab more bids per auction item. We found a major increase in bidding per person with SAP. Along with this tool, we are now able to see what and who donated items as in the past we were not able to track this. Having the ability to now see the percent return on auction items which we never had before. Very easy to enter donation and auction items!",Recommendations to other buyers: Support was out of this world and the help pages were very useful!
silent_auction_pro,Excellent Program for Auction,Jenna B.,Events Director,,,NO,Source: Capterra,5-Apr-16,5,4,5,5,5,10,"Comments: I have been running fundraisers for many years now and have never run into a program as efficient as Silent Auction Pro. Once you get your bearings, practicing on their well thought demo group, it is a cinch to use! I would highly recommend new users take the time to familiarize yourself with the program by surfing around the demo group and asking many questions way before your event is well under way and donations start rolling in. By doing this, it will elevate any issues when you are in the thick of event craziness and just don't have the time to call for help. Any questions I had were answered quickly and completely. Tracking winners, auction totals and all donations is super simple and made post event wrap up a breeze. My biggest fear at any of my events is always check out and this program made it so smooth, I almost questioned if I was doing it right. I would highly recommend Silent Auction Pro to a anyone who wants to run a less chaotic event.",,,,
silent_auction_pro,Seamless Transition from Online Auction to a Paper Based Silent Auction,Kirk N.,,,,NO,Source: Capterra,14-Mar-16,5,5,5,5,5,10,"Comments: Our church desired to do an online auction for 1 week followed by a dinner, paper based silent auction, and live auction. The transition from online to paper was seamless. For any of the online auction items that did not have bids we could simply printed bid sheets and put them into the silent auction. We had several multi winner items such as a Dodgeball Party that were offered in both auctions. It was easy to just print the bid sheets that already recorded the bids captured during the online auction. We also loved the fact that the multiple payments can be processed for an individual bidder and the invoice/receipt clearly captures the payment activity. During the weeks leading up to our event I had multiple questions for the technical support group. I posted my questions to support@silentauctionpro.com and always received a quick and thorough response. I think their support is top notch. We will definitely use Silent Auction Pro again next year.",,,,
silent_auction_pro,Silent Auction Pro was an incredible tool to expand our fundraising efforts with our auction event!,Jennifer S.,Director,"Philanthropy, 1-10 employees",Used the software for: Less than 6 months,NO,Source: Capterra,23-Apr-18,5,5,5,5,5,10,,"Pros: The software was easy to use and helpful in tracking donations to our event. I loved the bundling function that allowed us to create great auction packages for our school fundraising event. We have been hosting this event for several years and finally decided to take our auction online. Silent Auction Pro allowed us to engage a larger audience in our fundraiser. We also were able to raise more money by taking our auction online. Many auction items went for their true value, which helped us raise more money for our schools.The support staff were extremely helpful and always available to answer questions or review how we were using the tool.",Cons: There wasn't a lot that I didn't like about this software tool. One additional feature that would be nice would be the ability to email those that are attending your event (if you used the ticket purchase function) vs. all bidders.,,
silent_auction_pro,Our school had great success with Silent Auction Pro!,Teresa C.,,11-50 employees,Used the software for: 1-2 years,NO,Source: Capterra,29-Jun-16,5,5,5,5,5,9,,"Pros: Setting up the auction was easy to do with the software, ie: loading pictures and putting in descriptions. When the auction was over it was easy to see the totals and to charge each customer.",,"Overall: Our school used Silent Auction Pro for our online auction and ended up saving money on costs as well as making the largest profit we ever had for an online auction. Buyers told us they liked the way the auction items were set up, and that it was easy to bid and find out whether someone outbid them.",
silent_auction_pro,Excellent Auction Software for Our Nonprofit,Beth C.,Auction Coordinator,"Education Management, 11-50 employees",Used the software for: 6-12 months,NO,Source: Capterra,29-Mar-19,5,5,5,5,5,10,,"Pros: This software was very user friendly. Like any software if took some time to get used to the program, but after spending a short time with it, It was easy to navigate and enter items for the upcoming auction.",Cons: I do wish we could have set up user accounts for check-in/out people that didn't have to have email addresses connected to them.,"Overall: We had an excellent event with the Silent Auction Pro software. It made running the event so much smoother than I had expected. This was my first year at coordinator, but even my mentor (the past coordinator) said the software was much better than the past software.",
silent_auction_pro,Great service!,Catherine L.,National Symposium Silent Auction Co-Chair,"Education Management, 201-500 employees",Used the software for: Less than 6 months,NO,Source: Capterra,27-Jun-16,5,5,4,5,5,9,,Pros: The ability to organize donor information and link donations with donors. The search function. Generating bid sheets and reports. The ease of use.,"Cons: We issued bidder numbers. The bid sheets automatically included ""Name and Phone number"" (or maybe that's the default that can be changed?). With ""Name and Phone number"" on bid sheets, we had some bidders who were confused, but we were able to match their numbers by searching the database.","Overall: SilentAuctionPro was VERY easy to use and the customer service was AMAZING. Quick , almost immediate response, even after hours.",
silent_auction_pro,We bought the software a month before our event. Very happy with the service and fairly easy to use,ashley l.,Development Coordinator,"Non-Profit Organization Management, 1-10 employees",Used the software for: Less than 6 months,NO,Source: Capterra,4-May-17,5,5,5,5,5,10,,"Pros: I liked the customer service. Excellent, responsive help. We had not used event management software before. The online support - youtube videos and the exceptional phone support made the journey quite painless.",Cons: Wish there was a way to capture our donor detail from Silent Auction Pro and export it to our database in eTapestry.,Overall: Ease of check out at our benefit auction.,
silent_auction_pro,Great Value for the Money,Darcy E.,,,,NO,Source: Capterra,2-Jun-16,4,4,5,5,5,10,"Comments: Some silent auction management websites gouge you on you fees and commissions, really cutting into your fundraising ability. SAP provides all the basic functionality you need to run a successful auction without over-charging you on fees. There are a lot of features to choose from but you may need to hunt around a little to understand what everything does. The videos on the website are very helpful. Customer service is personally delivered and very responsive. We've worked with SAP to run our annual auction for about 5 years now and we've been happy every time. This was our first year running the auction completely online and the check out process at the end of the night was a breeze! Bidders do need to register an account ahead of time and that was the only function that ran less than perfectly, however support was quick to respond with assistance, even during non-business hours.",,,,
silent_auction_pro,SilentAuctionPro - 2 Enthusiastic thumbs up!,Jayna B.,,,,NO,Source: Capterra,24-Mar-17,5,5,5,5,5,10,,"Pros: Easy to use, eliminated need for all manual processes and encouraged most of our transactions to be electronic. Great customer support as well!",Cons: Users wanted to see the winning bid amount.,"Overall: I used SilentAuctionPro for our school's very first gala fundraiser and the experience was far above expectations. Not only was the software very user friendly, and had all the features we needed to make the most of our fundraising, the customer service is the best I've experienced. Questions were answered quickly and thoroughly, troubleshooting was done timely and support the night of the event was fantastic although not needed as much as i thought as everything went so smoothly! Would highly recommend to groups of all sizes!",Recommendations to other buyers: Card readers aren't required as everything can be done through the system quickly enough.
silent_auction_pro,Silent Auction Pro is worth a look.,Larry S.,Camp Director,,,NO,Source: Capterra,13-May-16,5,5,5,5,5,10,"Comments: Jim and his team made then selves available throughout the process. The feedback we received from the people who were biding on our items was, ""how easy it was to use."" Our only concern was on the admin side. Because we were in such a tight window from start to finish the admin side of the program seemed a little daunting. there were a ton of different drop down menus to navigate through. the software seemed to work well and like I said before the feedback from the bidders was they liked it and it was easy to use. Recommendation is give your self a couple of weeks to get familiar with the system, also if you can preregister people for the event this works best. We had 1200 people at a concert and trying to register everyone was overwhelming. All in all the program worked as designed and we are discussing how to better use the software for our next event.",,,,
silent_auction_pro,This is the second year our agency has used Silent Auction Pro and it is great.,Juanita P.,Office and Community Events Manager,,Used the software for: 1-2 years,NO,Source: Capterra,8-Jun-18,5,5,5,5,5,10,,"Pros: The silent auction pro software is easy to navigate, has simple forms, help videos and format of website. The staff are extremely friendly and always sending informative emails at the right time.",Cons: The silent auction pro layout of the auction items on the website can use a little touch up from a graphic designer.,,
silent_auction_pro,Silent Auction Pro is a great addition to our fund raising event!,Susie S.,Auction coordinator,"Education Management, 1-10 employees",Used the software for: 1-2 years,NO,Source: Capterra,20-Nov-17,5,5,4,5,5,10,,Pros: My favorite part of this program is that it is always in live time. Anyone on my team can look at it at any time and it's always up to date. Which means it is also a networking tool as well.,"Cons: I wish that once my donors logo is uploaded it would follow the donor on all printed materials., including bid sheets. I also would like to be able to export addresses of both the donors and bidders without having to have Microsoft office. In addition just being able to print a list with just addresses.","Overall: Being able to network, print cation, print bid sheets, cross check bidders with how many items they buy, we sent out blasts about items for sale, eventually online ticket sales and sort items",
