Its a tremendous user performance optimization,Ravikumar M.,Sap Basis Consultant,"Computer Software, 51-200 employees",Used the software for: 2+ years,NGC,Source: Capterra,"Oct 16, 2018",5,5,5,5,5,9.0,,"Pros: Its a column based and row based which is faster user data access , auto compressing the data and also parallel processing","Cons: Its time taking if we are not giving the software required hardware like memory, CPU, Disk space etc.. and also the will suggest the certified hardware partner.",Overall: Its almost 3 to 3.5 years experience of this software it was tremendous experience of this software it will get good user performance and business productivity and also its customer satisfied the overall performance,
Sap financial tool,Jacsy Merlin M.,Gerente de Ventas,"Accounting, 51-200 employees",Used the software for: 6-12 months,NO,Source: Capterra,"Jan 16, 2019",5,5,5,5,5,7.0,,"Pros: Sap allows me to take control of my suppliers, as well as the history of billing and payments through orders, on the other hand it gives me updated reports of the management of each user that uses the tool.","Cons: It is not a friendly application, it is complex and you must know the routes to be able to perform an exceptional job, you must also take care of the records to avoid duplicates of payments or invoices in my case that develop these activities.","Overall: Good only 2 months ago that I use sap, even it costs me a little bit the routes to be able to do the job quickly, however sap has allowed me to take an organized work, I can check credit notes with invoices and also with payments automatically After entering the necessary data for this process, in addition the updated reports allow me to control the expenses and the availability of the company.",
I use the industrial version but work for a retail company so that is a challenge on its own.,Verified Reviewer,Gerente de Ventas,,Source: Capterra,NO,Source: Capterra,"Apr 24, 2018",4,4,5,3,4,6.0,,Pros: I like being able to view all of the settings of an item on one screen and ability to customize setting such as restricting to specific vendors.,"Cons: I don't like that i can't view one style at a time but I believe that is due to the model that my company chose to purchase. We work with multiple sizes, it would be easier to view at a style level.","Overall: Learning about purchasing items from over seas as well as charging customers and processing POs. My first system in the""real world""",
"Very robust ERP system, flexible enough to accommodate to almost every need in our organization",Diego M.,Administrador General,"Higher Education, 201-500 employees",Used the software for: 2+ years,NO,Source: Capterra,"Jun 09, 2017",4,3,5,4,4,9.0,,"Pros: World class tool and support. Very reliable and stable system, that helped us to run almost every one of our business processes on it. As it is widely used, there are plenty of resources available to implement new functionalities and maintain the system.","Cons: It is not very user friendly, at least the client the final user works with. Maintenance cost is high.",Overall: Almost all the business processes are covered by the system. Very reliable and stable. Word class support.,
SAP and their products they are just the Top of ERP's,Daniel R.,Consultor Jr,201-500 employees,Used the software for: Less than 6 months,NGC,Source: Capterra,"Aug 01, 2018",5,2,5,5,5,10.0,,"Pros: I have been working with SAP hana for about 6 months, I have tried and used the tool and it seems to me that it is an extremely complex and complete tool. The trasactions of hundreds and even thousands of concurrent users and the speed and versatility with which HANA develops seems to me amazing.","Cons: Despite the tools and software that SAP provides for the migration of other environments to HANA, I had some problems presented at the time of migration of my platform. Once this has been solved, everything went perfectly.",Overall: You Guys just wont regret it only ur development environment its set and running,
SAP software is always great,keith u.,Accounting,"Accounting, 201-500 employees",Used the software for: 2+ years,NGC,Source: Capterra,"Apr 02, 2018",5,5,5,5,5,9.0,,Pros: SAP has very different kind of products but this one is one of the Best as it comes in cloud which reduces the infrastructure cost and time to implement and also it has both ERP and CRM,"Cons: SAP software are slow compared to other software and this one is not exception. Reports can sometimes run slow, especially from mobile",Overall: We have Used this system for the ERP system to maintain the clients and customers and make the organization connected,
What is hana,Kanishka A.,Business solution executive,"Information Technology and Services, 51-200 employees",Used the software for: 2+ years,NGC,Source: Capterra,"Jul 31, 2019",5,4,5,3,3,7.0,,"Pros: Good looking graphical interface ,it mainly uses to get analytical data and it uses in memory database technology ,which allows the massive amount of data to process in short period of time",Cons: It run only on SAP and also SUSE Linux certified hardware and high cost for hardware and implementation,Overall: Easy for analytical data processing and speed in retiving data,
All in One,Shashank G.,Business System Analyst - Intern,201-500 employees,Used the software for: 1-2 years,NO,Source: Capterra,"Jul 19, 2018",5,5,5,5,5,10.0,,"Pros: 1)Great Interface, Amazing Accessibility and Document Flow from one module to another. 2)Scalable to all types of small to mid-size organizations having 1-1000 employees.

3)Easy to use and learn and has provisions with Work Centers for CRM, SCM, FICO, PMO and HRM modules.","Cons: 1)Limited ability when it comes to specific module based requirements since it tends to be a generic all in one solution.

2) Has a very limited presence under the SAP Umbrella and very few people talk about it.",Overall: Scalable Implementations ensuring happy clients.,
'It's a total package - hard to beat',Verified Reviewer,Business System Analyst - Intern,"Human Resources, 11-50 employees",Source: Capterra,NGC,Source: Capterra,"Apr 23, 2019",5,5,5,5,5,10.0,,"Pros: SAP Business By Design is a well thought out ERP solution designed with the expertise gained in this field for over a decade.SAP have integrated CRM, accounting, project management, SCM, supplier relationship management, HR, executive management dashboards, and compliance in one single package and is offered as a SaaS. While SAP manages upgrading, hosting and maintenance, the system itself is scalable relatively to expansion of the business. Its super updating process allows users to manage accounts for multiple currencies in different stations. One of the outstanding features is the self learning material found in the system which helps to get the full potential of this complex all in one system.","Cons: As an advanced ERP and cost wise, this is more suitable for medium and beyond organizations.",Overall: It's a system hard to replace by competitors. I haven't found a user who is not satisfied with SAP.,
SAP MM for Purchase efficiency,Verified Reviewer,Business System Analyst - Intern,"Automotive, 10,001+ employees",Source: Capterra,NGC,Source: Capterra,"Apr 06, 2019",4,4,4,3,3,7.0,,"Pros: Accurate and instant information of all orders (PO) can be viewed and extracted anytime. Data extraction feature in excel is good.

Useful tool for process and data management (SAP ECC )","Cons: Purchase , implementation and service of software is very costly. More storage space required on server.",Overall: Effective tool but needs proper training for optimum utilization of software,
"Easily implemented, easily accessible software with inefficient training",Verified Reviewer,Business System Analyst - Intern,Pharmaceuticals,Source: Capterra,NGC,Source: Capterra,"May 16, 2018",4,4,4,4,3,7.0,,"Pros: I like the customizability and the openness to the software. There is a lot of maneuverability within SAP that is unmatched elsewhere, which is largely due to the fact that modules are built in-house. The support team for SAP is immense, and having worked with two pharmaceutical giants, the one that used SAP had more power to implement new functions.","Cons: The turnaround time on updates/upgrades is awful, there's just no other way to put it. You could design a new software from the ground up between updates.","Overall: The program allowed me to easily manipulate orders for clients, whether large or small. There's always an ease of understanding of how the system works, although there is a significant training investment required before it becomes user-friendly.",
International Purchases,Tadeo W.,Purchases - Machinery & Spare Parts,"Consumer Goods, 10,001+ employees",Used the software for: 2+ years,NO,Source: Capterra,"Feb 06, 2019",5,5,5,5,5,10.0,,"Pros: The ease that I have to put order, charge prices, search purchase history, review supplier data, among others",Cons: The difficult thing that it is done to the suppliers to be able to fill the Request of offer and be able to associate it with its number of parts.,Overall: Is a system with which I work every day bought all kinds of spare parts and equipment for the different polar lienas,
Powerful in-memory database for Transactional and Analytical Processing,Caroline I.,SAP B1 Consultant,"Computer Software, 51-200 employees",Used the software for: 6-12 months,NGC,Source: Capterra,"Oct 07, 2018",4,4,5,4,5,9.0,,Pros: I have interacted with with SAP HANA for one year now. Sap HANA is a powerful in-memory database by SAP that allows both transactions and analytics to run on it. Sap HANA allows for fast processing of large volumes of data.,Cons: SAP HANA is generally costly and more complex as compared to other database solutions for SAP in the market. I think the benefits offered by the database are totally worth every coin you spend on the database.,"Overall: SAP HANA is powerful. With this rapidly changing business environment, you need a database that can offer powerful analytic capability to help you make speedy and informed decisions for your business and stay ahead of the competition.",
I've been a SAP user for 10 years,Verified Reviewer,SAP B1 Consultant,Oil & Energy,Source: Capterra,NGC,Source: Capterra,"Jan 11, 2018",5,3,5,4,5,9.0,,Pros: Brings all the functionality needed to run a business into 1 system. The system is scalable depending on your needs and the size of your business,Cons: The system is used in so many industries and areas that it has a lot more features than you may need. This can be difficult for employees to understand why there are so many fields that they don't use.,,
SAP Manager,Mohammad K.,SAP Manager,"Supermarkets, 501-1000 employees",Used the software for: 2+ years,NGC,Source: Capterra,"Oct 08, 2016",5,5,5,5,5,8.0,,"Pros: Robust, fast, efficient & kool",Cons: cost wise and security with cloud.,"Overall: SAP HANA certified and using this product from last 2 years. It's awesome experience to use such fast and rapid product of SAP. Reporting is one of the sweet performance, millions of records can be extracted in short term. like ageing report & Financial logs management is great at its best.

I'm excited to use this product more than enough.

Rapid, robust and user friednly.",Recommendations to other buyers: All good
SAP Business By Design Review,Kgaugelo M.,Engineer in training,"Mining & Metals, 1001-5000 employees",Used the software for: 6-12 months,NGC,Source: Capterra,"Apr 10, 2019",4,3,5,3,5,10.0,,"Pros: I use it every second day at work anyand it is so functional in the day to day running and record keeping of the business. Keeps recorded input safe as long as you don't forget to click on the save command. I use it to capture daily production reports, incidents and observations at work. Makes recording keeping easy and organised.","Cons: Sometimes when I enter Actual hours in one of the tools we call ik34, it reads my hours as over where even when my hours are way less. I still haven't figured out what could it be that leads to that.",Overall: I would definitely recommend it to big corporations to keep record of their daily business running and keep it safe and organised.,
"I've been working for over two years with SAP Hana, implementing it at customers.",Jose Alejandro C.,Consultor SAP Basis Netweaver,501-1000 employees,Used the software for: 1-2 years,NGC,Source: Capterra,"Jun 25, 2018",5,5,4,5,4,9.0,,"Pros: This software in my experience is very good, when you have big data packages, for customers in large database about 3+ TB, and with high transactionality, its perfect, because the selects and searchs in database becomes very fast, its been known that most time lost is in database side consulting and searching, using indexes and it. But this HANA database it's been a new great solution for it.","Cons: Sadly, implementing sap hana can become very expensive for the customer, starting on a appliance or cloud system with high requeriments, like 500GB ram and few terabytes of disk, that would be the main issue, so not many customer can implement it.","Overall: A lot of experience. i've liked it, i think is the future of sap software, a good speed on database side can improve a lot any system, i even did the certificaction for sap hana 12, a good knowledge of it can make be grow profesionally.",
SAP - the ERP for anyone!,Angie B.,Accounts Receivable/Payable and Operations Manager,"Consumer Goods, 11-50 employees",Used the software for: 2+ years,NGC,Source: Capterra,"Oct 22, 2018",5,5,4,5,4,8.0,,Pros: We have used a version of SAP for 10 years now. SAP gave us one place to combine everything. Before SAP we used three different softwares to run our business.,Cons: Out of the box is somewhat basic. We found that we had to buy a lot of add ons via third party companies in order to make everything work the way we needed it to.,,
Expensive and Clunky,Michael B.,IT Systems and Solutions Manager,"Machinery, 51-200 employees",Used the software for: 2+ years,NGC,Source: Capterra,"Jan 23, 2018",4,2,4,2,4,8.0,,Pros: SAP ERP is powerful when properly configured and supported. There are a huge number of options and ways to configure the software,"Cons: Support options. It is quite expensive to get SAP products supported. Basically, if it has SAP involved, you can double your project timeline and add at least two zeros to the expected budget.",,
The best finance software for your enterprise,Bojan G.,Business Development Manager,"Outsourcing/Offshoring, 11-50 employees",Used the software for: 6-12 months,NGC,Source: Capterra,"Mar 08, 2019",5,5,5,5,5,10.0,,"Pros: I use the SAP suite at my current work, in particular SAP 4HANA finance and payment system. The positive side about this software is its easy to use, relatively user friendly overview. Easy to track data and particularly payments. it is integrated with our BACS payment, so no need to bother with manual payments. It is as well integrated with the various IT tool we use trhoughout the company so that financial data converge all into one place from the various tools. Easier to get the global view of trhe operations.",Cons: Can take time to learn. Graphics a bit outdated as with most SAP ERP software.,,
"While it's the Cadillac of ERP systems, it's EXTREMELY expensive, and not at all intuitive",Steve G.,Consultant,,Used the software for: 2+ years,NGC,Source: Capterra,"Jan 16, 2018",4,2,4,5,5,10.0,,"Pros: in the right, experienced, highly talented hands, it's SAP is immensely powerful, especially when paired with data visualization tools such as SAP Lumira or Qliqview","Cons: in lesser hands it's extremely easy to screw up, causing bad effects downstream, often unpredictable effects. It seems to be dominated by chaos theory",,
SAP Business ByDesign,Patrick M.,National Sales Manager,"Plastics, 51-200 employees",Used the software for: 1-2 years,NGC,Source: Software Advice,"Feb 17, 2017",4,4,5,4,4,8.0,"Comments: Overall, a very robust and insightful ERP system that connects all departments and ensures workflows and processes are being done correctly.","Pros: The fact that it's cloud-based is great for getting insights from any device, anywhere. Also, the extensive reports you're able to generate gives you great real-time data of your KPIs.",Cons: The customer support could use a little improvement in terms of data migration and system implementation.,,Recommendations to other buyers: Make sure you partner with a company whose expertise is in implementing this software into an organization.
The best ERP!,Brian J.,Owner,"Information Technology and Services, 1-10 employees",Used the software for: 2+ years,NGC,Source: Capterra,"Oct 04, 2017",5,3,4,4,4,9.0,,Pros: It is a great ERP. Is is integral and every company process is connected. It has industry templates that makes the start up easy for new companies in SAP.,"Cons: Sometimes the ECC look and feel is not the best, however you have a lot of information to find what you are looking for,",Overall: It is the best ERP that every company must have.,
ROBUST!!!,Jessica R.,Customer Service Specialist,Farming,Used the software for: 2+ years,NGC,Source: Capterra,"Oct 03, 2017",5,3,5,5,5,10.0,,Pros: I love how much you can get done with this software! So many nooks and crannies for information. Perfect tool in a manufacturing environment.,"Cons: Though it is quite a steep learning curve, once you get well trained it's quite the beast of a tool. It took me about a month of training to get the modules down.",,
I used SAP as an end and part of the implementation team,Funlola F.,CFO,,Used the software for: 2+ years,NO,Source: Capterra,"Dec 30, 2017",5,5,5,4,5,10.0,,"Pros: The robustness in a manufacturing company is second to none.

It is fully integrated with all the critical modules.

The user community forum is extremely helpful.","Cons: It is not quite intuitive.

The help glossary can use some improvement.

It is not easy to identify relevant transaction codes.",,
A very complete product in all areas of almost any company.,Verified Reviewer,CFO,,Source: Capterra,NGC,Source: Capterra,"Jan 11, 2018",5,4,5,4,3,9.0,,"Pros: It is a software that integrates with all areas of the company, is in constant evolution, the security part is super detailed,","Cons: The implementation is very complex, a lot of training is required, the certifications are expensive.","Overall: The productivity of many organizations was increased, and process times were reduced",
"As an HR Analyst, using SAP was phenomenal for its straightforwardness and capabilities.",Verified Reviewer,CFO,"Higher Education, 1001-5000 employees",Source: Capterra,NGC,Source: Capterra,"Jan 11, 2018",5,4,5,5,5,10.0,,Pros: The structure employed in the PA and OM modules makes data storage straightforward. The native reporting tools are strong and versatile.,"Cons: There is a lack of task-specific training literature, forcing a choice between learning through trial and error and taking broad courses on the topic.",,
SAP HANA,Verified Reviewer,CFO,"Financial Services, 10,001+ employees",Source: Capterra,NGC,Source: Capterra,"May 27, 2019",5,5,5,5,5,10.0,,Pros: SAP HANA is a very useful Database application used for data storage and it links directly to SAP BW instances. Provides very easy configurations options using SQL queries. User Setup and configurations is much easier using the SQL console in HANA.,Cons: one thing i dislike about SAP HANA is there is no option to see configurations of multiple users at one time. We have to enter each user one by one to see the setup.,,
Worth the Price!,David S.,IT Manager,"Electrical/Electronic Manufacturing, 51-200 employees",Used the software for: 6-12 months,NGC,Source: Capterra,"Jan 08, 2019",4,5,5,5,4,8.0,,"Pros: Our company was coming from an extremely static and out-dated ERP system so this solution was an absolute breath of fresh air! From the report builder to the Accounting modules, and the ability to have the entire system run in the cloud we couldn't go wrong.","Cons: Implementation was rough for us at first, so definitely allot more than enough time for users to get acclimated to the system whether there's 10 users or 100. The system also had some issues connecting to our SharePoint Online system to save reports and files generated from SAP but that was later corrected.",,
SAP ERP for Enterprises,Vijay S.,Architect,"Transportation/Trucking/Railroad, 201-500 employees",Used the software for: 2+ years,NGC,Source: Capterra,"Feb 02, 2017",4,4,4,4,4,9.0,,"Pros: Functionality, Value for Money",Cons: User Interface is not very intuitive,Overall: We use SAP ERP for our financials module at our organization and we are very happy with the functionality it provides. It is best suited for mid size organizations,Recommendations to other buyers: SAP Financials has been great tool for our Accounting and Control operations at our organization
Large software with features to match,Tom K.,Systems analyst,,Used the software for: 2+ years,NGC,Source: Capterra,"Jun 27, 2017",5,4,5,4,4,9.0,,"Pros: Encompasses entire operations landscape for a company, providing real time updates and information from customer interactions to company Financials.",Cons: Some processes within the software that are supposed to function identically show deviations from eachother,,
"Once you learn the system, it is easy to use for AR",Melinda K.,Credit Manager,"Wholesale, 201-500 employees",Used the software for: 2+ years,NGC,Source: Capterra,"Jan 09, 2018",5,4,4,5,4,8.0,,Pros: Levels can be reached from several points. You can move from a credit release queue to the AR screen quickly.,"Cons: Not many. Just takes time to learn the system. New users seem to struggle but given time, it becomes clear how easy the system is to use.",,
SAP ERP,Verified Reviewer,Credit Manager,"Hospital & Health Care, 5001-10,000 employees",Source: Capterra,NGC,Source: Capterra,"Mar 09, 2019",4,3,5,5,4,6.0,,Pros: Contains vast array of enterprise resource planning functions. Common software which is a transferable skill throughout different industries.,Cons: Very expensive and requires extensive training to unlock full potential of the software.,,
Game Changer,Sharon M.,Owner,"Health, Wellness and Fitness, 1-10 employees",Used the software for: 2+ years,NGC,Source: Capterra,"Dec 06, 2016",5,5,5,5,5,10.0,,"Pros: Intuitive, easy to use. Great reporting functions. Lockable modules to restrict user access.",Cons: Can be cost prohibitive to smaller companies and businesses.,"Overall: SAP software is an absolute game changer in terms of running a medium to large corporation. ERP, CRM & Financial modules are fantastic",
One awesome tool for running my company from end-to-end!,Shaun S.,Owner,"Restaurants, 1-10 employees",Used the software for: 6-12 months,NGC,Source: Capterra,"Jun 07, 2017",5,5,5,3,5,8.0,,"Pros: Set-up was a breeze! It came with many pre-configured business processes that once I got used to the navigation, I was able to set-up all of my depts. in under 3 hours.","Cons: I already had a server in place for my 7 person equipment company. However if you don't have a server, you'r queries and objects will be SLOWWWW. ANd not so much a ""con"" but their customer support....well I'll leave it at that.","Overall: I was able to get all of my depts and clients loaded fairly quickly. Reporting from front to back was easy to set up and the I was able to get the right reports when needed to show the ""health"" of my business",
Excellent product,Verified Reviewer,Owner,Utilities,Source: Capterra,NGC,Source: Capterra,"Dec 14, 2017",5,4,5,5,5,8.0,,Pros: Integration with state of art technology. Continuous innovation and business functionality gives edge over other products,Cons: Sometime multiple options of a requirement confuses. Business function wise selection option should be provided.,,
amazing gadget,juan carlos r.,Mi propio jefe,,Used the software for: 2+ years,NO,Source: Capterra,"Mar 30, 2018",5,5,5,5,5,10.0,,"Pros: amazing app for finance and accounting with modules that makes the work easier, faster and productive for everyone","Cons: expensive tools for new costumers, is not the first option in the market, it works just fine with some modules",,
Strong ERP,Aida G.,Corporate Controller,"Accounting, 201-500 employees",Used the software for: 2+ years,NGC,Source: Capterra,"Jan 22, 2019",4,4,4,4,4,8.0,,Pros: I like how every module is connected and the strong infra structure to keep subsidies reconciled.,"Cons: Writing reports is not that easy, you need more training to understand how the different tables are related.",,
"It is a very friendly software, reduces errors in inventories and billing, saving time and money",Carlos H.,"Creador de patrones, pattern design",,Used the software for: 2+ years,NGC,Source: Capterra,"Jun 27, 2018",4,4,5,4,5,9.0,,"Pros: You can track all transactions, who made them, time and date, to perform audits when needed, it is possible to keep a real inventory of the products we sell, provides reports that help in operations and daily budgets. It involves different areas of the company, such as marketing, accounting, sales, administration, finances, inventories, etc.","Cons: it does not allow to go back and make changes in the billing, neither it is easy neither fast to change information of clients","Overall: The benefits obtained by this software have been saving time, money, paper, I have control over inventories, customer information stored safely, etc.",
A multi faceted software with an abundance of data points,Chris S.,Director,,Used the software for: 2+ years,PGC,Source: Capterra,"Sep 07, 2017",5,5,5,5,5,9.0,,Pros: Drill down features are endless. You can find as much information about the data you are searching,Cons: The vastness of the user menu and the ability of not having a web based version. Currently have to login thru Citrix.,,
