company,title,name,position,industry,usage,paid_status,source,date,total,ease,feature,support,value,recommend,comments,pros,cons,overall,recommendations to other buyers
silent_auction_pro,Great Support and good for small non profit,Jennifer H.,Event Chair,"Fund-Raising, 1-10 employees",Used the software for: 1-2 years,NO,Source: Capterra,18-Apr-19,5,4,4,5,5,9,,"Pros: This is great software for silent auctions and generally a good value for a small non profit. They have amazing customer support with almost immediate response and the help section is fantastic. The on-line program for auction items is a tremendous feature. This gave us the opportunity to market our auction items in advance of the event and create a buzz. We love the ability to be able to pull up past donations and have the fields autofill - that saved a lot of work the second year we used the software. We also love the scheduled communications. We scheduled an e-mail 2 days prior to the event to go to all attendees with information on parking, dress, etc., as well as an e-mail 2 days after the event thanking people for attending. Lastly, we LOVE, LOVE, LOVE the e-mail/text notification for auction winners. So many people have commented on how much they appreciate this feature.","Cons: I will say there were a few quirks with ticket purchasing. We had 2 couples buy tickets and have receipts but they were not in the software anywhere. This happened last year as well. Silent Auction has yet to find out why this happened, but overall the ticketing system works well. Since this quirk happened the first year we had a ""back up"" plan if it happened to anyone this year and how we would handle it. I wish the site was more clear about security of the site and that the credit cards are going through the paypal system, not our computers. Some people get funny about buying items on-line and we have had a few of these instances/complaints. I also wish it was more clear when someone was buying multiple tickets that the first ticket was going to the buyer - and if the buyer was buying tickets for someone else they could change this in the system if they were not attending or already purchased their ticket. I wish there was a way to modify the bid sheet layout. I think the site could easily become more user friendly by creating buttons for some commonly used things - such as create a donor, create a donation - instead of links buried down in the page. So many of the links look similar and can get confusing for people that are not using the software on a regular basis.","Overall: I would love to see the other side of the database developed - the expense side. I would like to be able to run true reports revenue verses expenses. I wish Silent Auction Pro would have additional fields that could be labeled however the customer needed them - similar to creating different types of tickets but for other needs related to auction items. Lastly, I have only one complaint about the cost. I understand and accept the cost and 2% for auction items, however, it doesn't seems fair to have the charity pays 2% of the cost of a consignment item (ie. trip, autographed album cover) that cost $1000's of dollars. The charity ends up paying silent auction pro most of the profit they make on the item if they only make a couple of hundred of dollars over the consignment price. I believe the 2% should be on what the charity makes net on the auction not gross.",
silent_auction_pro,Excellent Choice,Lara K.,Executive Director,Hospital & Health Care,Used the software for: Less than 6 months,NO,Source: Capterra,7-Oct-17,5,4,4,5,5,10,,"Pros: This is terrific software, especially for a smaller nonprofit. What sold the software to us is that when I inquired about it online on a Saturday, I got an immediate phone call from the owner of the company and software developer. This was very typical of all interaction with this company throughout our use of the software - we got immediate responses from support when we had questions, they understand that auctions happen on weekends and support needs to be available then, and when we found a few quirks in the software they were repaired immediately, often by the developer personally. We previously used Greater Giving and BidPal; all three have features that I like and don't like, but overall SilentAuctionPro is by far the best value for the price. The a la carte pricing is a huge benefit for nonprofits like ours that cannot use all features (i.e. online bidding). Overall, from last year to this year (BidPal to SilentAuctionPro), we went from about 100 to 195 attendees, and from our worst checkout ever to our best. The instruction files, help menus, videos, etc were by the far the best of any nonprofit software we have used. We were invoiced after the auction for the software, which could be of great benefit for a nonprofit just starting out with their first auction.","Cons: I would love to be able to have a website where people can enter their own donations and have them populate as donation items in the system. There were a few quirks like the system not liking quote marks and ampersands. I would like for there to be a bit more explanation on the page about the security of registering your card as many of my guests weren't comfortable doing so at the time of ticket purchase. It would also be great to have more customization options for the ticket sales page. Because of the way we run our auction, I would very much prefer to be able to assign bidder #s to a household rather than to an individual, but this would have been fine if we had noticed it earlier and planned accordingly. I would also like to be able to customize a bit more on the receipts, include ticket descriptions, etc. I would have set up our fixed price items differently than we were advised to as I don't think it was the best option for our auction and was a bit of a hiccup, but in fairness it was something we didn't get to in advance and did on the fly, so it would have been avoidable with a little planning. Although the reports are generally pretty great, I did have to piece together a few to get to what I needed which could be a pain for someone with less Excel experience. Really minor, but because we can't use online bidding, I print our bidsheets on carbonless paper. Would very much prefer that the half sheet option printed as a 2up because I ended up reformatting them in Adob","Overall: Helped us run our best auction to date, with virtually no line at checkout, even though we had almost doubled our attendees from the prior year.",
silent_auction_pro,Tremendous system for making charity auction easier to set up,Charisse B.,Committee member/volunteer,,Used the software for: 1-2 years,NO,Source: Capterra,6-May-17,5,5,5,5,5,10,,"Pros: Donation entry was intuitive and loved that we could pull up items donated before so that we didn't have to retype everything. Demo environment allowed us to get committee members up to speed quickly and also allowed us to practice on some creative set up to meet our auction needs. Ticketing feature offered a variety of ticket options, some only displaying with a promo code, and love the addition of the asking for the email address for a ticket purchasers' guests - made it simple to reach all attendees with the marketing tools. Allowing the ticket purchasers to select the meal, or any other item we programmed made the table/catering coordination easy. Marketing features to promote the event to our attendees as well as help them feel connected to the event that was a couple months away. We set up an online auction the week before our event and people loved it! The online auction was open to the public so it allowed parents to share with friends and family that weren't planning on attending. We posted the event auction items on the online auction as previews to entice bidders to attend to get a chance at the rest of the silent and live items. Reporting is good, check in/out is all on one page, the system performance is great. Loved working in system even from our smart phone browser to check on things, make changes etc. any time, any where. Customer support was outstanding!","Cons: Special characters aren't allowed in donation title so we had to change once they got loaded as an auction item. Special characters in the description like "" for inch threw off the formatting of the data export to excel. Reporting is good, but would have liked a few more reports or the ability to create ad hoc reports. We found one report provided this item, but another report provided this item so we had to export to excel and do look up functions which is tedious to do each time. Would like more options for formatting of bid sheets, and also would like to see some additional options with displaying, leveraging the ""Donation Tag"" feature which is critical for us as our teams need to be identified. Would like filters on lists as well.",Overall: Set up and run the event solely from volunteer committee without having to contract with other services for ticketing or check in/out. Handle high volume auction and attendee counts with smaller committee.,
silent_auction_pro,Silent Auction Pro helped us manage over 400 auction items at our event.,AMY A.,Secretary,"Non-Profit Organization Management, 11-50 employees",Used the software for: 2+ years,NO,Source: Capterra,15-Apr-17,4,4,4,5,3,9,,"Pros: Silent Auction Pro allows us to manage a high volume of donators, donations, auction items, bidders, etc. Customer support is great, they are always available to answer my questions timely. Loved the phone call the day before the event to share the 800 number. Love that we can email receipts to winners. Love that we can notify winners via email or text once a table is processed. Like that you can have multiple users at same time, especially at event day, doing data input, checking in bidders, checking out winners.","Cons: 1) Certain characters are not liked by the program (inch symbol, & symbol), especially when exporting to excel. 2) Bid sheet area to write in bids is too crowded, would like options to modify bid sheet layout, not sure if we can or not but would like opportunity to export bid sheets to a file and add ""NO BIDS"" on back side of page 3) Price went up from last year, both module cost and %. 4) Would like more options to print vs export and when exporting to design what fields and sort order, especially on sold items 5) Dont like that when you create duplicate items that they are linked and then if one is not sold it cannot be deleted without deleting them both 6) When you update an auction item, you go back to the donation, update, then update auction item. It does not always take the updated title from the donation as the new title of the auction item. Cannot figure out why. 7) would like the name on the bid sheets to be larger font, as we had two bidders get the wrong cards and not know that it was not their name at the top 8) Would like bidders to write more clearly :) (I know, out our your control) 9) Would like a quicker way to see what auction items have no bids at the end of the event instead of scrolling through the page","Overall: Silent Auction Pro allows us to manage a high volume of donators, donations, auction items, bidders, etc. Customer support is great, they are always available to answer my questions timely. Loved the phone call the day before the event to share the 800 number. Love that we can email receipts to winners. Love that we can notify winners via email or text once a table is processed. Like that you can have multiple users at same time, especially at event day, doing data input, checking in bidders, checking out winners.",Recommendations to other buyers: Customer Service is great!
silent_auction_pro,"Silent Auction Pro - Good, but with some significant reservations",Alan H.,Gateway Gala chair,"Entertainment, 51-200 employees",Used the software for: 6-12 months,NO,Source: Capterra,9-Nov-16,4,2,3,5,3,7,,"Pros: Capturing information about donors and donationsCreating auction items from donationsChecking guests in and out, and providing them with invoicesBid entry (except for Fund-a-need)","Cons: Handling reservations and guests, especially couples and other groupsFormatting bid sheets - very little control over this formatHandling creation and bid entry for fund-a-needRequirement to create a merchant account with Vantiv","Overall: Southern Gateway Chorus used Silent Auction Pro (SAP) to manage our Gateway Gala for 2016, our major fund-raiser of the year. We found much to like about it, but also a few things that could stand improvement.",Recommendations to other buyers: Be sure to train all the people who will be involved on the day of your event.
silent_auction_pro,Silent Auction Pro Thought of Everything!,Stephanie D.,Volunteer Event Chair,,,NO,Source: Capterra,10-May-16,5,5,3,5,3,7,"Comments: Overall, I am extremely pleased with this software. I was totally immersed in it, learning every possible feature and application, to ensure that we got the maximum use.Pro's:1. The Help section is extremely well documented, and the customer support is amazing. The You Tube videos were very helpful for training both me and my volunteers. Any time of the day or night when I sent an email, I had an immediate response.2. The options available were extremely comprehensive and knowledgeable about the mechanics of a benefit fundraiser. I cannot think of anything that I wanted to do that I couldn't do. From donor setup, to bidding styles (purchase of ticket parties for Teacher Experiences, to Silent Auction bidding, setting different minimum bids etc) to performance tracking, exporting info, everything was there.3. The buzz that we created with the auction was definitely a boost to our event. We doubled our attendance vs. last year, just by starting the auction 4 weeks before the event, and creating excitement about the items that we offered early.4. I am now set up for next year, with over 50% of the input work established already (donors, pictures and logos, bidders, etc). Next year should be a lot easier!5. Auction Day section is powerful and easy to use - The check in was easy, online bidding was easy, and checkout was VERY easy, especially for those who had already registered their credit cards online. I could just click ""auto process"" for a batch of auction items, and with a click of the button, 20 people were checked out at once. Then I just looked up the auction number, passed out the gift envelopes or baskets, and done!",,,,
silent_auction_pro,A Software that DEFINITELY Helps you Raise More Money,Cindy J.,Executive Director,"Non-Profit Organization Management, 1-10 employees",Used the software for: Less than 6 months,NO,Source: Capterra,24-Mar-17,5,5,5,5,5,10,,"Pros: This was our first use of this software and we were very satisfied with the results we achieved the night of our event. The software is relatively easy to use - the modules are marked but you do need to take you time to make sure you are on the right page. The customer support was fantastic. Every time I had a problem or a question they were there to answer it. They were able to go into my site, analyze my problem and help me solve it.",Cons: The modules could be designed to be easier to differentiate.,"Overall: This was our first use of this software and we were very satisfied with the results we achieved the night of our event. The software is relatively easy to use - the modules are marked but you do need to take you time to make sure you are on the right page. The customer support was fantastic. Every time I had a problem or a question they were there to answer it. They were able to go into my site, analyze my problem and help me solve it.",
silent_auction_pro,"Saved Us Time, Trouble And Confusion!",Celia A.,Volunteer,"Education Management, 11-50 employees",Used the software for: 2+ years,NO,Source: Capterra,17-Jun-16,5,5,5,4,5,10,,"Pros: You can enter your donations one time and duplicate them if you have more than one or if you are repeating the same items the next year, you can see where your volunteers are in the process of getting their donations and they can mark their status, you can bundle lower value items together to make a larger basket and it is easy to do, the check in and check out at our event was fast! And, I was able to enjoy the actual event for the first time.","Cons: Not really a con, but a suggestion if you use this software: have a designated person in charge of using the software and train everyone to enter the information consistently. I think their best practices was helpful'it saves time to make sure you take that step so you don't have to edit a bunch of things later.","Overall: Before finding Silent Auction Pro, we were doing everything by hand. It took up a lot of everyone's time and led to a lot of frustration. After a very stressful night of having people waiting for us to hand calculate their winning bids and asking us every five minutes if we were ready, we decided there must be a better way to do this. A fundraiser should be fun! It has fun in the name! So I found Silent Auction Pro. It made such a difference to not have all of those people waiting for us to give them their winning items and invoices. And, checking out was quick. I highly recommend for events like silent auctions.","Recommendations to other buyers: This was a learning curve piece that I will share: sell tickets through silent auction pro'there isn't a charge to do it (we had already printed postcards and were selling tickets at the school so I didn't think about it the first time). If you sell the tickets using silent auction pro, all of the info is stored so you don't have to enter it later and it is much easier to track everything and the ticket purchasers don't even have to check in."
silent_auction_pro,Auction software - JUST PERFECT FOR US!,Emily D.,Finance Officer & Volunteer Extraordinaire,"Financial Services, 5001-10,000 employees",Used the software for: 2+ years,NO,Source: Capterra,20-Dec-16,5,5,4,5,5,10,,"Pros: Add donor, add donation item, save! The extras are great:logos & pictures for displays, the communication tool saved us & we were able to message our bidders with auction highlights.","Cons: After our 2nd event, the system usage seemed more intuitive. We didn't realize how many features we could have used that first time! Would love the system to accept AmEx, not just Visa/MasterCard.","Overall: Three years ago was the first time we used SilentAuctionPro. And we used it again for this year's event. SAP handled our 450+ donations with five users, 200 auction items, online bidding by 225+ guests and the raffle ticket feature.",
silent_auction_pro,Silent Auction Pro is the BEST value available with amazing customer support!,Amy J.,Nonprofit Consultant,"Non-Profit Organization Management, Self-employed",Used the software for: Less than 6 months,NO,Source: Capterra,19-Oct-16,5,4,4,5,5,10,,Pros: It is intuitive and and easy to learn. Support team is very responsive and is constantly updating the product. It offers the absolute BEST value of any auction software I have used or researched! The mobile product is clean and user-friendly.,"Cons: Some of the functions are a bit hard to find. You do have to be a self-starter to research all of the functions and know exactly what is needed before the gala night to check in, check out, and close the auctions. I had to contact customer support several times throughout the evening for assistance.","Overall: As a nonprofit consultant, I have worked with a variety of nonprofit organizations on their gala auctions. I recommended Silent Auction Pro to a nonprofit pre-school for their gala. We utilized all of the features offered by SAP, including a live and silent auction, the mobile feature and the event planning features with a very user friendly table assignment function. The product is very responsive and intuitive, and helped this organization raise over $79,000 above sponsorships and ticket sales the night of the gala!","Recommendations to other buyers: Start very early to learn the product and do all of the research. Work in their Sandbox demo and do a mock event training with committee members well before the event. Make sure you have plenty of people to do different functions - a separate cashier at check-in and throughout the event. Several committee members are needed to procure, enter auction donations and help package them. Another committee should be responsible for reservations, seating, and check-in."
silent_auction_pro,Sheboygan Service Club,Heather C.,Foundation Treasurer,Fund-Raising,Used the software for: 1-2 years,NO,Source: Capterra,30-Nov-16,4,4,4,5,4,8,,"Pros: Silent Auction Pro helped our auction and operations team see data (auction items, ticket purchases) on a real-time basis. Previously, we relied on spreadsheets and emails, and version were easily confused and confusing. It was also great to tally up totals at the end of the evening quickly to make a grand total announce while all guests were present.","Cons: This was our organization's first time using mobile bidding and it was received with mixed reviews. It was confusing for some to login if they didn't receive an email. We will collect emails at registration next year to make it smoother. The QR codes on the items were great, but most guests did not already have the app on their phones. It was difficult, at times, to scroll through items. Lastly, it would be great to have a cross reference for ""baskets"" by individual. We weren't sure why the numbers continued from 2015 rather than starting fresh for the new event.","Overall: Silent Auction Pro is a powerful tool for fundraising events. Login is smooth for past members and new members of the organization. Once you're on the site for some time, it's neat to see all the various ways data can be sorted and viewed. Mobile bidding was an interesting transition for our group and guests, but I think it will become smoother every year. The software has made tasks for the auction and operations team smoother every year with the saved data. It was great to see our member's work real-time, so we knew where we were at for auction items and ticket sales. It's also great to have the data saved in one spot from year to year.","Recommendations to other buyers: If you group will be going with the mobile bidding, try to post items in advance and have folks sign-up to the site in advance. If this happens, guests will spend less time at the event looking at their phone and trying to figure it out."
silent_auction_pro,We have used Silent Auction Pro for the past three years to manage our school auction.,Heidi H.,PTA president,,Used the software for: 2+ years,NO,Source: Capterra,15-Apr-18,5,4,5,5,5,10,,"Pros: The biggest pro for our organization is the customer support. It's superb. Being a rotating group of volunteers, we don't always have the technical know-how to manage the software right out of the gate each year, but the team at SAP really helps get us there by being available, knowledgeable, and clear with their guidance. Other pros: the functionality is robust, allowing us to do everything we need (set up online, silent, and live components of our auction, plus sell raffle tickets and track a fund-a-need). The platform is well organized and easy to navigate.","Cons: It does take some time up-front to learn the software and all that it can do. Sometimes we worried that we weren't using it at its full capacity or were taking more steps than necessary to complete a task. However, I think this is particular to our situation, because our group changes every year.",,
silent_auction_pro,Windsor Farm Elementary PTO Silent Auction Pro Review,Lisa S.,Volunteer Coordinator /Board Member,Philanthropy,Used the software for: 6-12 months,NO,Source: Capterra,27-Mar-17,5,5,5,5,5,10,,"Pros: Easy to use, great customer service, able to manage all needs in one platform.",Cons: n/a,"Overall: Silent Auction Pro provided an ease and professional quality to our annual auction we had not previously enjoyed. In years past, our annual elementary PTO Fundraiser and Silent Auction was a tedious process. We would create our Bid Sheets and Display Sheets on separate programs. We would have another person create our event programs. Our donations would be logged in an Excel Spreadsheet. We would have ticket sales go through the office secretary. It wasn't seamless and it wasn't efficient. The checkout process at the event was also a mess as we didn't pre aucthorize credit cards and would have weeks of clean up trying to collect money from bidders who left without paying.",
