Vendini Ticket Agent has made selling tickets a breeze.,Noel M.,CEO,,Used the software for: 2+ years,NGC,Source: Capterra,"Mar 07, 2018",5,4,5,5,5,7.0,,"Pros: Ticket Agent accommodates our small venue theater. Follow the steps and you are selling tickets from a multiple of platforms: laptop, iPhone, computer, and iPad to name a few. You can quickly tab into the show, date, and preferred seats your patron desires without issues. The ability to hold seats, set seats aside (not for sale), and provide handicapped seating through the ticket agent only if that is your preference, are just a few of the simple elements that are completed with only a couple keystrokes.",,Overall: Ticket Agent could only be better if we could select exact seats when selling from a cellular phone. This is one of the great attributes available on computer.,
Vendini continues to evolve and grow. The reports are great.,Diane H.,House and Box Office Manager,,Used the software for: 2+ years,NO,Source: Capterra,"Nov 30, 2017",5,5,5,5,5,7.0,,"Pros: Ease of use. Set up is simple. Email marketing is very easy to use, and very useful. Patrons live it too.","Cons: The only thing I can think of is, I would The an easy way to email patrons attending a specific date of a performance. There is a workaround to do this, but I would like a couple clicks way to do this.",,
"Easy to use, great reporting capabilities, excellent customer service",Jennifer L.,ASB Clerk,"Education Management, 51-200 employees",Used the software for: 2+ years,NO,Source: Capterra,"May 25, 2018",4,5,4,5,3,8.0,,Pros: The thing I like most about the software is it's reporting capabilities and that it is a cloud based software.,"Cons: The thing I like least is the cost. I feel that Vendini charges too much for their online fees however, it does seem to be in line with the industry.",,
Vendini,Verified Reviewer,ASB Clerk,"Higher Education, 501-1000 employees",Source: Capterra,NO,Source: Capterra,"Jan 23, 2019",4,5,4,3,4,7.0,,Pros: Ease of Use. Easy to set up an event.,Cons: Not much connection with the support team.,,
No problems! Quick support when needed,Bonnie B.,Production Manager,"Entertainment, 1-10 employees",Used the software for: 2+ years,NO,Source: Capterra,"May 04, 2018",4,4,5,5,5,8.0,,Pros: The software is intuitive...it is easy to follow. You don't need a lot of computer experience to use it.,Cons: I know some companies that have opted out because they didn't feel Vendini gave them enough marketing information,,
Vendini makes running a theatre so much easier with its comprehensive ticket selling services.,Verified Reviewer,Production Manager,"Performing Arts, 11-50 employees",Source: Capterra,NGC,Source: Capterra,"Feb 11, 2018",5,5,5,5,4,10.0,,"Pros: Vendini has, not just ticket selling functions, but marketing, but patron and donor management features too.",Cons: The de-duplication feature could use some improvement as one currently can't remove delicates by address.,,
Vendini has made ticketing super easy for us,Bill L.,Operations Manager,,Used the software for: 2+ years,NO,Source: Capterra,"Oct 17, 2017",5,5,5,5,5,10.0,,Pros: The ticketing software is very easy to use. Vendini has made everything from setting up events to selling tickets a very straight-forward and intuitive process. Training new box office staff takes almost no time at all.,,,
Lack of Flexibility And Improvements Held Back An Otherwise Good Service,Chris C.,General Manager/Owner,"Entertainment, 11-50 employees",Used the software for: 2+ years,NGC,Source: Capterra,"Apr 09, 2018",4,3,3,4,3,3.0,,Pros: Includes most of functions needed in a ticket system at a price comparable with other pro systems. The interface is fairly straightforward.,"Cons: I used Vendini for many years before switching to a competing service. One of the main reasons I switched was that FOR YEARS Vendini refused to implement suggested features, improvements, and upgrades. By contrast, the competing service (still a client) often implements suggested features within days or weeks.",Overall: Worked well enough for years with core functionality. But company failed to improve or implement suggested features.,
Best decision my venue has made!,Shelley C.,Managing Director,"Performing Arts, 1001-5000 employees",Used the software for: 2+ years,NGC,Source: Capterra,"Feb 17, 2017",5,5,5,5,5,10.0,,"Pros: Ease of use/training

Marketing add ons to the ticket system",Cons: It is not as customizable as I would like.,Overall: The Vendini system has been the best investment we could have made in opening our venue. The ease of use and overall features have been a blessing to us as we navigated getting our patrons to use a new ticket system. The staff is always available to help and they are always finding new ways of improving.,
"We do approximately 450 ticketed shows per year, and Vendini makes our job so easy!",Lisa G.,Box Office Manager,,Used the software for: 2+ years,NO,Source: Capterra,"Aug 09, 2017",5,5,5,5,5,10.0,,"Pros: Ease of use! From building events to selling tickets, we find it extremely easy to maneuver. Designing event layouts - Gift Card Availability - Event Reminders","Cons: Sometimes we have delays in reports loading, but this may be due to our amount of data. We would like to see the availability of Gift Card use with package purchases.",,
The BEST reservation/ticketing software !,Michelle D.,,,,NO,Source: Capterra,"Mar 03, 2017",5,5,5,5,5,10.0,"Comments: I looked for ten years (no kidding) for the best software for our reservations and ticketing needs. We tried a few during that time frame that just didn't work well enough to suit our needs. I stumbled upon Vendini at an INTIX conference and instantly fell in love. The software has done exactly what I need AND the developers LISTEN to my needs and have actually improved the software based on our requests. They answer the phone when I have problems and FIX it, right away (there has only been a need for this a few times in over 4 years). The additions and features with all the available reports have made my job so much easier. We are more efficient in our marketing efforts (which has saved us a ton of money) due to the reports that tell us where our customers are coming from. The website that is attached to the software makes it a snap to always have the most up to date information on the web for our customers (which in turn has cut down on the number of phone calls from customers because they can easily find that info about us on our website now)

Try it... (I don't work for Vendini)... The day you sign up will be a very happy day. Your job will become so much easier, efficient and FUN. Plus Vendini has Camp Vendini every year where you can go and learn more about the functions of the software, learn about business in general and have some good old fashioned FUN networking with others from the same industry.

I recommend Vendini 100%",,,,
Ticketing made simple,Jim P.,Director of Operations,"Entertainment, 1-10 employees",Used the software for: 2+ years,NO,Source: Capterra,"Feb 16, 2017",5,5,3,5,5,10.0,,Pros: ease of setting up and selling tickets,Cons: Waiting for easier ability to manage VIP add on Benefits for events,"Overall: Vendini was already in place when I started at the Riviera, and I am glad that it was. I can have events ready to sell in minutes and have full control over my ticketing.",Recommendations to other buyers: Use it!
Using Vendini for on-line tickets has been the best thing we have ever done for our business!,Linda H.,Owner & Proprietor,,Used the software for: 6-12 months,NO,Source: Capterra,"Apr 04, 2018",5,5,5,5,5,10.0,,Pros: This software has simplified my job and given me extra time to devote to other pressing things. It is easy to use and addresses all of my needs. Customer Support is supreme.,"Cons: Well, I have no cons, but it seems I cannot submit this review without writing in this box at least 100 words. There. I'm done.",Overall: Ease. Simplicity. Creativity.,
A great Company that keeps you in control of your ticketing,Jim P.,Director of Operations,"Entertainment, 1-10 employees",Used the software for: 2+ years,NO,Source: Capterra,"Feb 23, 2017",4,5,4,5,5,10.0,,Pros: Ease of use,"Cons: Adding VIP event add ons (meet & great, etc)","Overall: We love Vendini - from the ease of creating events, to the customer transactions it gives us everything we need.","Recommendations to other buyers: Use it, and don't be afraid to call support..."
Easy to use! love it.,De H.,Executive Director,,Used the software for: 2+ years,NO,Source: Capterra,"Oct 23, 2017",5,5,5,5,5,10.0,,"Pros: User friendly. It posts to Facebook automatically. When sending an email you just click the event to share and all the information is generated for you, no retyping it again.","Cons: The member fees....but they are comparable to others, so we really can't complain. Waiting 90 days to receive the last funds from an event.",,
Vendi online ticketing has boosted our ticket sales!,Bill E.,Marketing & Media,,Used the software for: 2+ years,NO,Source: Capterra,"Aug 07, 2017",5,5,5,5,5,10.0,,"Pros: The step by step process for setting up each event is straightforward and super easy to use. For our customers, using Vendi online to purchase and print their tickets is uncomplicated and trouble free. Our presale ticket prices are slightly discounted, so online tickets purchased through Vendini save our guests money as well assist us in projecting our event attendance.",,"Overall: If you run into trouble or are uncertain about how to access features, the customer support team is friendly, knowledgeable, and willing to assist you right away.",
Vendini and Forks & Corks,Kate A.,Executive Director,"Marketing and Advertising, 1-10 employees",Used the software for: 2+ years,NO,Source: Capterra,"Feb 16, 2017",5,5,5,5,5,10.0,,Pros: Everything,Cons: None,Overall: We have used Vendini for the past 2 years to sell tickets to our large scale food & wine festival. Our tickets historically sell out in minutes. Using the Vendini platform for ticketing is very user friendly as easy to use for our patrons to purchase tickets. I especially like the ipod touch scanners for day of admission. We were able to move 1500 patrons through the one entry gate to our event within 15 minutes using Vendini equipment. Will continue to use Vendini year after year!,Recommendations to other buyers: Excellent customer service if you ever need help using Vendini
Best decision we ever made!,Ane M.,Managing Director & CEO,,Used the software for: 1-2 years,NO,Source: Capterra,"Jan 15, 2018",5,5,5,5,5,10.0,,"Pros: Ease of use and customer support. I'm no techie, but I'm able to navigate the software with ease. And if I have a problem or question, Vendini customer support is so quick to answer and always helps me out!",Cons: I'd love to see us be able to capture as donations the money people add to their ticket price when they donate through buying tickets.,,
feature rich and professional,Erik P.,Director of Technology,"Religious Institutions, 11-50 employees",Used the software for: 1-2 years,NO,Source: Capterra,"Dec 04, 2018",5,5,5,5,4,8.0,,"Pros: My role for a while was setting up events for ticketing in Vendini. I was very impressed with all the features. Chances are, whatever you wanted to be able to do with your ticketed events, there was a way to make it happen in Vendini. Discounts, packages, comps, fees - it was all there. Also, the support, which we only needed a little at the very beginning, was very good.","Cons: It was expensive. We decided to pass along some fees to the people buying tickets. There was some complaining at first, but honestly not much. (To save some money, we printed our own complementary tickets and then marked those seats as unavailable in the program.)",,
Vendini box office software,Melissa E.,Ticket Office Manager,,,NO,Source: Capterra,"Oct 29, 2014",4,5,5,5,4,8.0,"Comments: Pros: Easy to set up, clear and concise screens, easy to use and to train new staff, feature rich and affordable. Very good, usually fast, response from customer service.",,,,
What a discovery..and it keeps getting better!!,Janie W.,Box Office/Office Manager,"Education Management, 201-500 employees",Used the software for: 2+ years,NO,Source: Capterra,"Aug 02, 2018",5,5,5,5,5,10.0,,"Pros: Ease of use, so simple to do exchanges.. I love processing orders with this program. Intend to try out some new features.","Cons: Enjoy it all, just need more time to play.","Overall: Great program, eady to use and user friendly. Looking forward to incorporating new features. I don't think we will ever use anything else as its been years and it gets better and incorporates updates!!",
"It's refreshing to deal with our Vendini colleagues. Prompt, courteous, helpful and knowledgeable.",James M.,President,,Used the software for: 2+ years,NO,Source: Capterra,"Nov 14, 2017",5,5,5,5,5,10.0,,Pros: We find the software quite intuitive and Vendini keeps adding new options that draw us closer to our patrons. That is a good thing.,,,
Easy to set up. Easy to track sales and generate reports. Good support when needed.,Jerry B.,President,,Used the software for: 2+ years,NO,Source: Capterra,"Jul 17, 2018",5,5,5,5,5,10.0,,Pros: Ease to prepare and use throughout the season. Like that a whole season worth of ticketed events can be set up. Also like the ease of repeating previous years templates with just minor edits and changes.,"Cons: I have not purchased nor utilized the scanning and printing software. Also we have not used the assigned seating option. Totally not against this extras, just don't have the front of house staffing and ability to use.",,
"Easy for a small company, but limited functionality",Liam C.,Teaching Assistant,"Performing Arts, 51-200 employees",Used the software for: 2+ years,NGC,Source: Capterra,"Aug 08, 2018",3,3,3,5,5,6.0,,"Pros: All online aspects of running a small performing arts center are accessible and integrated through one fairly simple platform - eblasts, patron database, ticketing, website, etc. There is no need to pay for or learn additional platforms, which is great when you're working on a small team.","Cons: The website builder is pretty limited and seems to need consistent maintenance by the Vendini team. Ticketing events and web features are integrated, yes, but what each function links to and how it will appear live online is often very unclear. I've often had to get in touch with customer service to find work-arounds for bugs and glitches that cause small strange inconsistencies in the website-ticketing flow.",,
Great product. Easy to use.,Thom B.,Director of Theatre Arts,"Performing Arts, 1-10 employees",Used the software for: 2+ years,NO,Source: Capterra,"Jul 31, 2018",4,4,5,5,4,10.0,,Pros: Set up is a breeze. Customer service is amazing. Ease of use for patrons is terrific. Ticket printing is easy.,Cons: Hard to figure out the reports. Really time consuming to enter credit card info without optional card swipes.,"Overall: Organization of our show. Selling tickets online.

Hassle free for the most part.",
Appreciate this great software and support.,Annie D.,Owner/artistic director,,Used the software for: 2+ years,NO,Source: Capterra,"Oct 17, 2017",5,5,4,5,4,10.0,,Pros: Ability to tailor it to my needs. Like quick deposit of funds. Like appearance for user and producer,Cons: large list view when I have multiple events. Wish we could have a table view. Too much to scroll for my festival master classes.,,
The Cadillac of Ticketing Software!!,Cory B.,,,,NO,Source: Capterra,"Sep 10, 2015",5,5,4,5,4,10.0,"Comments: I cannot begin to express how amazing Vendini is. I operate the ticketing duties of our small community theatre and Vendini has been a treasure for us. From the setup of shows to the selling of tickets at the door to the listing of our shows on our website, Vendini has been there for us!",,,,
Maybe It's Just Me but I am NOT Impressed,Verified Reviewer,,"Architecture & Planning, 11-50 employees",Source: Capterra,NGC,Source: Capterra,"Nov 24, 2018",1,1,1,5,4,10.0,,"Pros: Honestly, I do not like this software for the most part. I will admit I have not used a lot of the other ticketing software however this one just seems awkward, unreliable and clunky.","Cons: Many times during checkout, all of the information will disappear and people will need to start over with the order. Other times, guests have reported not being able to be sure they actually had their order processed. From a technical backend perspective, there are just no options. I went to WIX and could design a website much easier with a ticketing option that looked 1000x better. The problem is that the theater company I am helping wants to use this cause it is all they know. There are no templates for website design (which how do you not have this - its 2018 - not 2004??) This just seems like a platform built in the mid 2000s that was never improved upon. The links that were generated for ticketing were not working and the only way to get to the correct page, I needed to create bitly links.. that is just not acceptable.",Overall: I have helped the theater company create events and sell tickets using this system but I do not recommend.,
Flexible and reliable system,Courtney B.,Director of Ticketing & Group Sales,,,NGC,Source: Capterra,"Nov 05, 2014",4,5,1,5,4,10.0,"Comments: Overall, Vendini is an advanced ticketing system with mostly positive attributes. Every system has it's flaws but for the most part Vendini's technology and customer service outweigh most of the flaws. We use the system in a unique form and the system is relatively flexible in meeting our needs. The built in consignment manager and email marketing components are features that other systems do not current have. The packages and shopping cart features are what we use the most and Vendini's team is very receptive to user ideas and feedback on how to improve the system.",,,,
Great customer service,Jamie M.,Festival director,Marketing and Advertising,Used the software for: 1-2 years,NGC,Source: Capterra,"Feb 16, 2017",4,4,3,5,5,9.0,,Pros: Easy to use and setup,Cons: Wish the email option offered more options,Overall: Love Vendini staff! They help setup our events and provide constant help! We just setup our 2017 festival and they were great at troubleshooting,Recommendations to other buyers: No
Vendini Review,Ruth O.,Gifts Processing Specialist,"Non-Profit Organization Management, 51-200 employees",Used the software for: 1-2 years,NGC,Source: Capterra,"Feb 21, 2019",3,3,2,5,5,3.0,,Pros: I suppose that the dashboard design is practical and quite simple to navigate.,Cons: The inablility to design practical and useful reporting. I have been unable to design a streamlined report; more than one report has to be generated and then combined in order to get all the information we need on one report.,Overall: I am not content with the software.,
Easy to use.,Brandon L.,President,,Used the software for: 2+ years,NO,Source: Capterra,"Aug 07, 2017",4,5,4,5,5,3.0,,"Pros: We love Vendini!! Ease of creating events, to the customer transactions it gives us everything we need. It is wonderful to keep all of our consumer information all in one location.",Cons: Still waiting for the Android based software. That is our only grip at this time. Looking forward to having this soon.,,
I'm a big fan of Vendini,Laura A.,,,,NO,Source: Capterra,"Feb 16, 2017",5,5,5,5,5,3.0,"Comments: I appreciate how easy it is to use the program, and that when I do call with any kind of issue I am rarely treated like a ""number"". It has happened a few times over the years, but more times than not I feel that the person I am speaking with will do whatever they can to solve my issue or find the person that can. This is one of the first things I tell people when speaking about Vendini. In this age of automated customer services, it is very nice to speak to a real person that seems to truely care.",,,,
An incredible company to work with!,David O.,,,,NO,Source: Capterra,"Feb 16, 2017",4,5,4,5,5,3.0,"Comments: Vendini, is one of the best vendors I have worked with. I've built some incredible relationships with many of the awesome people they employ and they're always right there ready to assist us when we need help! Their solution is simple and easy to use, that requires very little training when new staff start. It has an easy interface, that employees and students just understand. I've looked at many solutions for for ticketing systems, but none come close to the Vendini all in one solution.",,,,
Vendini Perks,Tabitha H.,,,,NO,Source: Capterra,"Feb 16, 2017",4,4,4,5,5,3.0,"Comments: Overall the system has been a great change for us. We have had a huge learning curve as with any major changes, but the end result has been great. MerleFest is a tricky system to maneuver and so far, they have managed to meet most of our needs. We still have some work to do with system errors from time to time that can't be explained, and the Logistics Manager piece is at times challenging because of all our specifics, but overall, very greatful for the change.",,,,
Pleased with Vendini!,Laurie K.,Co-President,"Entertainment, Self-employed",Used the software for: Less than 6 months,NO,Source: Capterra,"Mar 08, 2017",5,5,5,5,5,10.0,,Pros: Easy to use,,"Overall: Switched from another ticketing platform and was nervous about the ease of transition. From end to end, the process was seamless & pleasant. They are partners & problem solvers.",
We love the simplicity of the site and the software. It's easy to teach anyone how to work it!,Elizabeth M.,Bookkeeper/Events Assistant,"Non-Profit Organization Management, 1-10 employees",Used the software for: Less than 6 months,NO,Source: Capterra,"Jun 04, 2018",5,5,5,5,5,10.0,,Pros: It's easy to use and can be used even when you don't have a seating chart. We were able to steer all of our customers to the site through our website and there were no complaints at all!,"Cons: Sometimes it can be hard to figure out how you want things, but for the most part this is the easiest software we've used!",,
This is what you need to run a successful box office!,April S.,,,,NO,Source: Capterra,"Feb 17, 2017",5,5,5,5,5,10.0,Comments: Everything you could possibly need is provided by Vendini. They are always looking for new ways to keep their product innovative and fresh. They have great customer service and they really care about your company and you and that's what I want in a company. Their is no need to go anywhere else it's all here.,,,,
Really Useful,Earland M.,Music Producer,"Entertainment, Self-employed",Used the software for: Less than 6 months,NGC,Source: Capterra,"Apr 16, 2019",5,4,5,3,3,10.0,,Pros: This is the software I used to get my first ever tickets for my first show,Cons: I don't remember having any problems to be honest,Overall: Great and I would recommend it to everyone,
Great All-in-One for Theaters!,William B.,Box Office Manager,"Performing Arts, 1-10 employees",Used the software for: Less than 6 months,NGC,Source: Capterra,"Jul 24, 2019",5,5,5,3,3,10.0,,"Pros: This software integrates very well with every piece of FOH in a theater. From seating to donor relations, it does it all with ease and with mobile/tablets.","Cons: Cost is a huge component and we have a great deal with another system, otherwise, we would have stuck with this!",,
