silent_auction_pro,Children's Safe Harbor Gala,Sally T.,Gala Co-Chair,"Non-Profit Organization Management, 11-50 employees",Used the software for: Less than 6 months,NO,Source: Capterra,16-Jun-16,5,5,5,5,5,10,"Comments: We purchased Silent Auction Pro for our annual fundraiser for Children's Safe Harbor, a non-profit children's advocacy center in Conroe, TX. We were specifically looking for a program that would help facilitate the check in/check out process for our 500 guests attending our gala on May 6, 2016. We had struggled the last couple of years because we had gone from 100 or so attendees to 400 in 2015. Trying to accommodate that many guests and over 100 auction items was getting overwhelming. Silent Auction Pro not only made it go like clockwork, we also had the benefit of all of their great customer service, basically 24/7 for all of our questions getting everything set up. Their staff had an answer for every question we had as well as tips for making the whole event go smoothly. It was amazing to log in on the day after our gala and have all of our auction data grouped and organized and a complete database of all of our guests. We're excited for next year and will be adding more of the Silent Auction Pro options to our event, such as ticket sales and preregistration of attendees with their credit card info for even easier check in. I have to say that the one on one customer service we received was exemplary and the main reason that we were so successful this year!",,,,
silent_auction_pro,Awesome Product!,Jenniferu K.,Bookkeeper / Parent Volunteer,"Accounting, 201-500 employees",Used the software for: 2+ years,NO,Source: Capterra,27-Jan-17,5,5,5,5,5,10,,"Pros: Ease of use, affordability, bid sheets are clean and professional.",Cons: Credit card set up takes time.,"Overall: I used this software at my kids preschool auctions for three years and now that they are in elementary school, I convinced the staff to try it and we all love it. It is user friendly, intuitive, affordable, and has great customer support. I recommend it highly!",Recommendations to other buyers: It is the BEST value for your money.
silent_auction_pro,Modular product allows you to easily manage your auction/event,Sara G.,Fundraiser Liaison,,,NO,Source: Capterra,25-Apr-15,5,4,5,5,5,10,"Comments: I was first drawn to Silent Auction Pro because of it's modular pricing structure. Our event is modest and most products I looked at offered way more functionality than we needed and came with a hefty price. We were able to purchase just what we needed to manage our event in a simple and elegant manner. It was great to use a multi-user system, so my team could help input donations. As I learned how to use the platform and manage my auction/event accordingly, the Silent Auction Pro support always responded quickly and gave me clear instructions as well as helpful suggestions. We'll definitely be using this product again next year for our event.",,,,
silent_auction_pro,Auctions are easier now,Megan M.,Managing Director,"Construction, 1-10 employees",Used the software for: 2+ years,NO,Source: Capterra,11-Nov-16,5,5,5,5,5,10,,"Pros: ease of information input, ability to check history of items, bidders and donors, flexibility with picture and logo uploads",,Overall: The capabilities of this software save me hours. The updated look of the online item listings is fantastic. My donors feel like they are getting properly recognized within the listing of their item. The price of this software is also very reasonable.,
silent_auction_pro,What a help this software was!,Melissa S.,Volunteer,,,NO,Source: Capterra,23-Mar-17,5,4,4,5,5,10,,"Pros: Ease of checkout, final reports available, check in with credit card scanners was a breeze",Cons: Turning auction items into baskets was a confusing process,"Overall: We were looking for a new software to use for our annual Gala's Silent Auction. Our biggest issue in the past was check-out at the end of the night. After collecting the bid sheets at the end of the auction, we entered all the winners and printed out lists of who had won in just about 1/2 an hour! Such a stress-reliever!",Recommendations to other buyers: Clearer instructions of how to enter auction items at the start would be a big help at the end
silent_auction_pro,First time user for annual fundraising event.,Melanie C.,Executive Director,,,NO,Source: Capterra,9-Sep-15,4,4,4,5,5,10,Comments: Love the automatic assignment of bidder numbers; this makes tracking every guest's purchases much easier. This was our first time having guests pre-swipe credit cards and it was a huge hit! Check out was incredibly fast. Next year we will request more card swipers to speed up check-in; we had 3 swipers for 225 guests.,,,,
silent_auction_pro,Fantastic Auction Website,Kaity W.,Instrumental Music Teacher 6-12,"Music, 51-200 employees",Used the software for: 6-12 months,NO,Source: Capterra,24-Feb-19,5,5,5,5,5,10,,"Pros: Customizing features, choices in pricing, ease of use.","Cons: Sometimes finding the videos on specific features was difficult through general search, but the on phone support resolved any question immediately.",Overall: Great customer service! Helped our event run very smoothly. Felt supported from start to finish! Great company!,
silent_auction_pro,Octoberfest Fundraiser,Kathie Z.,member,,,NO,Source: Capterra,18-Oct-14,5,5,5,5,5,10,"Comments: Just finished out first use of Silent Auction Pro. We got a late start for our event, but with the great help from Jim at Silent Auction Pro, we were able to log a very successful event! There are so many aspects to the program that help organize your work that we were unable to use them all due to the late start. But NEXT year, we will have all our sticks in a row well in advance of our event, thanks to S.A.P.'s keeping all our records and making contacts so much easier for next year. Finding your computer literate person to start the ball rolling was our only initial challenge due to our aging congregation, but hey, we found him!!",,,,
silent_auction_pro,It made running our event so easy,Brandie H.,Auction Chair,,,NO,Source: Capterra,17-Sep-14,5,5,5,5,5,10,"Comments: I cannot say enough good things about Silent Auction Pro! It was so easy to use and made the work of our London PTO Fall Fest & Auction look so organized and professional. The Auction Day component was worth every penny. The bid entry personnel finished in record time of less than 30 minutes for over 300 items. Check out was a breeze and accepting credit cards was a wonderful addition to our event. We have had nothing but positive comments on our auction from volunteers and guests. This was our first year to use Silent Auction Pro, but certainly will not be our last. Thank you for creating such a wonderful program at a reasonable price",,,,
silent_auction_pro,Excellent - it met all of our needs!,Peggy C.,Development Director,,,NO,Source: Capterra,7-Apr-16,5,5,5,5,5,10,Comments: We selected this software for our first try at mobile bidding for our event because of:,,,,
silent_auction_pro,Easiest auction yet!,Courtney L.,,,,NO,Source: Capterra,28-Oct-16,5,4,5,5,4,10,,Pros: Simplifies the auction process and provides online capability.,,"Overall: We have used Silent Auction Pro for several years for our PTO silent auction. It's always helped a great deal with generating bid sheets, tracking items and processing payments. This year we tried the online auction and we were very pleased at how simple this made our auction! The software provides everything you need to get items online and bidding online. Better yet, when the auction closed we had people checked out and out the door in less than 30 minutes, where it used to take us over an hour before.",
silent_auction_pro,The best thing we have ever done for our silent/live auction.,Rita D.,Event Coordinator,,,NO,Source: Capterra,12-Mar-15,5,5,5,5,4,10,"Comments: I have been an event coordinator for a non-profit for the past (5) years and have used the Silent Auction Pro for the last couple of years. I cannot tell you how much smoother and less stressful our events have been. Many positive comments about the quick check-in and check-out which has always been the weak link. Being able to change items mid-stream was a bonus and a lot less stressful than trying to do everything from spreadsheets and all of our printed material was very professional. The data bases it builds, the file shares, the display boards. I could go on and on. I highly recommend Silent Auction Pro.",,,,
silent_auction_pro,Candlelight Gala 2016,Tracie R.,Event Manager,"Non-Profit Organization Management, 1-10 employees",Used the software for: Less than 6 months,NO,Source: Capterra,30-Nov-16,5,5,5,5,5,10,,Pros: Check out Process,Cons: After auction reports are somewhat confusing,"Overall: Silent Auction Pro was extremely easy to use and to teach others to use. The price is very practical and we loved the different options. You only buy what you need.The check-in and check-out process went very smoothly and all of our guests commented on it.",
silent_auction_pro,Review,Gina B.,Parade,"Construction, 1-10 employees",Used the software for: Less than 6 months,NO,Source: Capterra,16-May-19,4,4,4,4,5,9,,"Pros: love all the training videoslove the help via phone and emailslove that most of my questions were attended to in a timely fashion","Cons: A little difficult to add images to the cover page.Not sure why there is a cover page the link took people directly to the donation button, maybe, this is a good technique, but I feel like we were not able to get our mission and logo to those participating.","Overall: Overall it was great, minus the couple items mentioned above",
silent_auction_pro,AutismUp Has 3 Years of Success Using Silent Auction Pro!,Beth C.,Special Events Manager,,,NO,Source: Capterra,14-Jul-15,5,5,4,5,5,9,"Comments: Until we came across Silent Auction Pro, our non profit special event committee was tracking donations using a spreadsheet which was so inefficient. When looking for an appropriate application to increase productivity prior to, on, and post event day, Silent Auction Pro was the best choice in terms of functionality and price.",,,,
silent_auction_pro,Great solution,Tamiko A.,Auction Chair,,,NO,Source: Capterra,12-Oct-14,5,5,4,5,5,9,Comments: What a great solution Silent Auction Pro is for all kinds of auctions. We have used Silent Auction Pro the last couple of years for our Pirates of the Cure-A-Being Silent Auction where we raise funds for local cancer organizations. In the past we have used other online solutions which either double billed our bidders or was just plain archaic to use. Silent Auction Pro gives a seamless solution to incorporate your ticket sales & auction needs. The application is also really easy to figure out and train people even a couple days before your event. This is definitely our go to solution for our events!,,,,
silent_auction_pro,Love this program!,Julie M.,,,,NO,Source: Capterra,20-Feb-17,5,5,5,5,5,9,Comments: I have been using Silent Auction Pro for the past 5 years for our Kiwanis Club of Napa annual Crab Feed fundraiser. This is always a big job but using this program makes it a lot easier for me. The bid sheets are prepared through the system and all I do is print them out the day before the event and it's easy to make edits or changes after. This program also generates thank you letters after the event. There is always good support available when needed. I would recommend this to anyone having a fundraiser or event! Thank you Silent Auction Pro.,,,,
silent_auction_pro,I used it for our Annual Rotary Major Fund Raiser In Marin County,Farhad T.,Event Manager for 2016 Golf,,,NO,Source: Capterra,9-May-16,5,5,5,5,5,9,"Comments: The ticketing, Silent Auction and donation requests were so wonderful and productive. We increased our net donations after all costs by 50% with less staff and volunteers!!",,,,
silent_auction_pro,Great customer service,Kelly S.,Auction Chair,"Fund-Raising, 11-50 employees",Used the software for: 6-12 months,NO,Source: Capterra,16-Apr-19,5,5,5,5,5,10,,Pros: Useful training videos and help section to cover all questions. Customer service responds quickly and answers all questions. They are so easy to work with!!,Cons: I didn't have any concerns with this software.,,
silent_auction_pro,"Intuitive, detailed, easy-to-use and most importantly, a money maker for your fundraiser!",Jeanine C.,Public Relations Manager,,,NO,Source: Capterra,23-Mar-16,5,5,5,5,5,10,"Comments: This software has every feature you could possibly need and is so easy to use. The tutorials and Help sections are so detailed that you can always find the answer to any question. There is no doubt that the on-line bidding feature helped us exceed our fundraising goal. Our guests quickly ""jumped on board"" and discovered the ease of bidding. Check-out was a breeze and no one stood in long lines at the end of the night waiting to reconcile. We will use Silent Auction Pro again next year and look forward to more growth for our school because of it!",,,,
silent_auction_pro,Easy to learn.,Laura R.,Director of Communications,,,NO,Source: Capterra,25-Mar-16,4,4,5,5,5,10,Comments: Easy to learn and great help with any questions or workarounds that may surface. This is our first year using Silent Auction Pro and as it was a new facet to our auction we had a learning curve. The team at SAP was very helpful as we moved forward and right there in the busy days leading up to our event. Software breaks down our returns and gives amazing data to measure our auction results as well. From posting and promoting our catalog of items online to the bid sheets it created to the measurements it provided post auction we are very happy!,,,,
silent_auction_pro,Silent Auction Pro,Michelle L.,Director of Finance,,,NO,Source: Capterra,10-Nov-15,5,4,5,5,5,10,"Comments: This is our first year to go ""mobile"" with our silent auction and I have to say that Silent Auction Pro far exceeded my expectations! Everyone enjoyed being able to socialize more since they didn't have to stick close to the items they were bidding on. It was as simple as that familiar sound of a text message coming in then you look at your phone and increase your bid! From an administrative point everyone that has hosted a silent auction knows how hectic it is especially check-out! Wow, what a great experience for all. No long lines.",,,,
silent_auction_pro,Silent Auction Pro,Doug H.,President,"Philanthropy, 1-10 employees",Used the software for: Less than 6 months,NO,Source: Capterra,30-Mar-19,5,5,5,5,5,9,,Pros: Straight forward to use. Most every scenario has been considered and baked into the software.,"Cons: Setup of cc company was somewhat challenging, but mostly due to cc vendor, rather than Silent Auction Pro.",Overall: We had some learnings from our first event using Silent Auction Pro. We hope this will allow an even better future event.,
silent_auction_pro,4 Time User and I Don't PLan On Changing,Fref B.,,"Education Management, 11-50 employees",Used the software for: 2+ years,NO,Source: Capterra,25-Sep-16,5,5,5,5,5,10,,Pros: User friendly and very flexible.,,"Overall: Another great event due to Silent Auction Pro! User friendly system right from the first entry to collecting the final payment. Makes fundraising events successful, professional and enjoyable. Get the maximum support from your community for your event with Silent Auction Pro.",
silent_auction_pro,Great Software for Our Fundraising Event - From Start to Finish!,Donna P.,,,,NO,Source: Capterra,30-Oct-16,5,5,5,5,5,10,"Comments: Silent Auction Pro helped us to manage and organize our fundraiser from start to finish. From setting up ticket sales online, organizing auction donations, keeping track of our guests' purchases to check-out at the end of the night with customized receipts for our guests. Post-event reconciliation was a breeze and we could quickly see the results of the event auctions and item sales. No more multiple spreadsheets and calculations! Silent Auction Pro was a tremendous help for our event this year!",,,,
silent_auction_pro,"If you run any auction, you MUST use this tool. It will saved 100s of hours",Farhad T.,Executive Team,"Non-Profit Organization Management, 1-10 employees",Used the software for: 2+ years,NO,Source: Capterra,28-May-19,5,5,5,5,5,10,,Pros: Retaining prior history to help with our annual golf tournament.,"Cons: Once you learn the basics and review the recorded sessions, there is not much that was needed.",Overall: It reduces the number of hours and increases the goal of fundraising.,
silent_auction_pro,"Simple, Intuitive Silent Auction Software that won't break the bank",Marion H.,,,,NO,Source: Capterra,14-Dec-14,4,5,5,5,5,10,Comments: Getting this software took us from the stone age to the modern age. It has saved tons of time and effort! Every step of our silent auction timeline was simplified. You guys pretty much thought of everything.,,,,
silent_auction_pro,Super slick and easy!,Sally R.,Coordinator,"Non-Profit Organization Management, 1-10 employees",Used the software for: Less than 6 months,NO,Source: Capterra,31-Mar-19,5,5,5,5,4,10,,"Pros: Entering donations, creating auction items, signing people up for our event, watching the bidding process - all went smoothly. I think my favorite was how fun it was to see all our auction items online and be able to share our auction link with family and friends to reach a broader audience!","Cons: I thought it took a little longer to get the hang of the program then I expected and wasn't quite as intuitive as I wanted it to be. Once I spent time with it though, it made a lot more sense and realized the issue might have been me, the user!",Overall: Excellent!,
silent_auction_pro,Silent Auction Pro - You need to use this software.,Edward C.,Past President,,,NO,Source: Capterra,20-Mar-15,5,5,5,5,4,10,"Comments: We have been using SAP for about 5 years now. Consistently the program, the support and the leadership have been exactly as you would expect. Professional, quick and thorough with any request or comment. We have made suggestions over the years and seen changes implemented. They actually listen to their clients. If you need to do an auction or even an event, this is the software for you. We typically have around 200 items at our events. Very fast check out process and an excellent donation tracking process.",,,,
silent_auction_pro,Small School Auction,Jennifer K.,Committee Head,,,NO,Source: Capterra,25-Feb-16,5,5,5,5,4,10,"Comments: This is the 3rd time I have utilized Silent Auction Pro software for a school fundraiser. It is intuitive, simple, and made us look polished and organized. Features I loved most include: Easy Check-in, Easy Check-Out, entering of winning bids, and the integrated credit card feature. Also loved the Videos to self-train. All in all, I would use this software again in a heartbeat. The value for the price is unmatched! Jim and his team are excellent to work with. Recommend without hesitation.",,,,
silent_auction_pro,Great system...just what we needed!,Pete G.,Mission Advancement Director,,,NO,Source: Capterra,7-May-15,5,4,5,5,4,10,"Comments: Silent Auction Pro gave us a very professional and organized look to our auction. As an administrator, it is well organized. However, there are so many bells and whistles that it does take a little while for a new administrator to learn the system. Thankfully, there are many video tutorials, and the customer service was great! As a guest/bidder, it is easy to navigate through the online bidding, and the check-out process was very smooth. We definitely plan on using this system for future auctions.",,,,
silent_auction_pro,Wonderful Software!,Gretchen B.,Managing Director,,,NO,Source: Capterra,11-May-15,5,5,5,5,4,10,"Comments: I used Silent Auction Pro for the first time at our fundraiser last month, and I can't say enough great things about them! The program was easy to use and improved our check out process so significantly that guests actually commented on how smooth it was. The customer service was OUTSTANDING through the entire process. And I can't wait to use the tracking to make next year's auction even easier and more successful. If you're looking for a way to make your auction user friendly, call these folks!",,,,
silent_auction_pro,24th Annual Hollywood Charity Horseshow,Carey N.,Event Coordinator,,,NO,Source: Capterra,24-Oct-14,5,5,5,5,4,10,Comments: We used Silent Auction Pro to host the silent auction for the 24th Annual Hollywood Charity Horseshow hosted by William Shatner. Silent Auction Pro was so great and easy to use. We had never done an auction like this before and they made it easy and fun. Jim was exceptional in that he followed up with us multiple times to make sure that we had everything that we needed and that everything was done correctly. We had a very successful event and Silent Auction Pro was a huge contributor to that success.,,,,
silent_auction_pro,Exceeded expectations!,Jeanna W.,,,,NO,Source: Capterra,10-Dec-16,5,5,5,5,4,10,"Comments: Wow! Silent Auction Pro made our event so easy! Before Silent Auction Pro the check out process at our auction was crazy stressful. People did not keep track of what they won and trying to make sense of it all was insane. This year checkout could not have gone smoother! One person handled it all with ease and even though some patrons initially resisted online bidding, we ended up almost doubling our profits this year! Not to mention the outstanding customer service!",,,,
silent_auction_pro,Silent Auction Pro is GREAT!,Jeanie R.,,,,NO,Source: Capterra,13-Oct-16,5,5,5,5,5,9,,Pros: Online platform allows multiple volunteers to access account at one time.,,"Overall: We just had an auction at my church and Silent Auction Pro worked GREAT for us! It was very user friendly for entering and tracking donations. It also made check-out go much quicker since we could have multiple volunteers logged into our account at one time, accepting payments and printing invoices! We were completely done about a half hour after the auction closed. :)",
silent_auction_pro,Gets better with each use!,Gretchen B.,Managing Director,,,NO,Source: Capterra,6-May-16,5,5,5,5,5,9,"Comments: We started using Silent Auction Pro a year ago and have now used it for 3 events - 2 large and 1 small. With our first use, I could tell this program was going to be a game changer for us and the more we use it, the more the benefits grow! I'm now able to fine tune our auction based on data from earlier events, as well as compare event data from event to event. I would recommend this program to any fundraiser and look forward to using it at our auctions for years to come!",,,,
silent_auction_pro,Great software! Great customer service!,Jill M.,Auction Chair,,,NO,Source: Capterra,5-Dec-14,5,4,5,5,5,9,Comments: Thanks again to Silent Auction Pro for helping St. John the Baptist Wines to Wishes be a successful event! By using your web based system we have been able grow our event in community involvement as well as the financial return year after year.,,,,
silent_auction_pro,"This has been at least our 6th or 7th year we have used this program, it has worked well for us.",Adrianna P.,Parent Volunteer,,,NO,Source: Capterra,23-Mar-16,5,5,5,5,5,9,Comments: Pro: Plenty of online resources to train on. Jim or other tech support is very available and friendly to answer questions and teach. User friendly. I cannot imagine the headache of running this event without having a program like Silent Auction Pro! Check in and Check out functions are very easy.,,,,
silent_auction_pro,easy to use,Patricia G.,Silent Auction Chair,,,NO,Source: Capterra,7-May-16,4,4,5,5,5,9,"Comments: pros, having more than one person to input donations, payments etc.cons - I had some trouble making the numbers reconcile",,,,
silent_auction_pro,Great help for beginners!,Marjorie W.,,,,NO,Source: Capterra,4-Mar-16,5,5,5,5,5,9,"Comments: Silent Auction Pro provided much needed structure for us. Personnel were patient and understanding, and always professional. We were relative beginners and Silent Auction Pro offered useful guidance from start to finish. The program offerings went from the generic ""how to"" of organizing a silent auction to detailed instructions for thorough record keeping before, during, and after the event. It was thanks to Silent Auction Pro that we met our fundraising goal!",,,,
silent_auction_pro,Silent Auction Pro fit our organization and event perfectly. It was affordable and easy to use.,Erika Z.,Executive Director,,Used the software for: 6-12 months,NO,Source: Capterra,30-Oct-17,5,5,5,5,5,9,,Pros: Most of all I like the price. I also like that the Help section is very thorough and had videos. My representative was also very helpful and had used the software themselves.,,,
silent_auction_pro,Fantastic Tool,Sonia P.,PTO President,,,NO,Source: Capterra,19-Dec-14,5,4,5,5,5,9,"Comments: This is our small Charter school's second year ( 280 students) utilizing the tool. It is really a great tool. It is super easy to enter items in to determine bidding pricing and increments. It is amazingly easy to check people in and incredibly easy to check people out! I do wish that the item detail was a bit longer :) the customer service provided by jim and jennifer is spot on , immediate and extremely helpful!!! i highly recommend this tool to groups big and small!",,,,
