company,title,name,position,industry,usage,paid_status,source,date,total,ease,feature,support,value,recommend,comments,pros,cons,overall,recommendations to other buyers
patronmanager,A 21st century solution for a growing arts organization,David L.,Executive Director,,Used the software for: 2+ years,NO,Source: Capterra,"Jan 09, 2018",5,5,5,5,5,10.0,,"Pros: We worked with Patron Technology to migrate 12 years of ticketing/membership/donation transactions to PatronManager CRM in 2015. The technical staff, many of whom have direct working experience in nonprofit arts organizations, understood our goals completely and tailored the application for our unique requirements. The support team is knowledgeable, responsive and dedicated to our success.",Cons: PatronManager CRM requires a training investment by the staff and leadership to get the most out of the product. This is true of any new system -- but there is a terrific reward to making that investment of time.,"Overall: PatronManager CRM has helped us gain a more complete insight to our patron relationships, and is invaluable in recording details of our patrons, donors and members. We have used this information to grow our earned and contributed revenue. The tools provided by PatronManager have made several staff positions more productive, and more satisfied in their jobs.",
patronmanager,We have been using PM for 2 years and learn something new everyday.,Nicole L.,General Manager,,Used the software for: 2+ years,NO,Source: Capterra,"Dec 21, 2017",4,3,4,4,4,9.0,,"Pros: We have seen our single tickets increase dramatically with online capabilities, which we didn't have until starting with PM. Support staff has been very responsive. Having the system has cleaned up a lot of previous human error as we took reservations on handwritten forms for the prior TWENTY NINE years. With VoIP phones and this cloud based ticketing system we have the ability to allow BO staff to work form home when needed - answering phones and making reservations as if they were sitting in the office.","Cons: Subscribers with flexible packages can not go online to make individual show reservations. That is very unfortunate for us with over 5,000 subscribers in non-traditional subscription packages. Reporting take a bit of time to get used to. We are still double checking each other's list pulls to be confident they are correct. I also find there are some traditionally standard BO operations that can't be done, which frustrates me. I don't think the system should dictate how we do business. I suggest you appoint or hire a systems administrator as your go to person on staff. They'll have a lot to learn, program and continue to maintain. Our Audience Services Manager dedicates, on average, 8 hours a week to system administration.","Overall: Increased sales. Online sales capabilities. Less human error in making reservations and a quick ""checks and balances"" with confirmation emails. No surprises at curtain of patrons being booked into the wrong night. Faster reservation making because there is no more handwriting. Much more accurate sales reporting. Sales that tie into our accounting figures.",
patronmanager,We've been using PatronManager for four years; the system has been nothing short of transformational,Amy W.,Managing Director,,Used the software for: 2+ years,NO,Source: Capterra,"Dec 21, 2017",5,4,5,4,5,10.0,,"Pros: Comprehensiveness: We now conduct all our business through PatronManager including ticket sales, marketing, development, education, and a national tour. This has been transformational for our ability to segment our audience and communicate in a truly personalized way with all our patrons and donors.","Cons: Due to PatronManager's fast growth, there have been times when tech support response times have been extended. However, when that has happened, PatronManager has always moved quickly to make necessary changes and communicated with customers openly about the challenges and the timeline.",Overall: It has facilitated significant growth in ticket sales and fundraising by making it possible for us to have a 360 degree view of everyone in our database.,
patronmanager,Could not do my job without PatronManager,Arieal W.,Box Office Manager/Database Administrator,,Used the software for: 2+ years,NO,Source: Capterra,"Dec 21, 2017",5,4,4,5,nan,nan,,"Pros: Overall this is a great program. The CRM aspect is important and of course useful, but the most impactful part of the program for our organization is reporting. We would not be able to effectively run our business without the many reporting options available in this program. We can compare sales year over year, create campaigns for marketing and development, and so on. All layers of the database including ticket sales and donations speak to each other so we can pull reports for almost anything. Not to mention, if I do not know how to do something the support team will assist me. My background is customer service and the Patron Manager team exceed my expectations. They are extremely helpful and knowledgeable. They are great teachers. I also like how this program is customizable. There are tons of additional applications (some paid, mostly free) that can be added to PatronManager. These additional applications are very helpful. I recently downloaded one that will allow me to manage our volunteer program. Its truly a lifesaver.","Cons: One con is the response time for support. We do have the ability to mark the urgency of a support request, and they will respond immediately for urgent requests, but it would be nice to get a quicker response for even non urgent matters. Sometimes the little issues are still a big deal.",Overall: It has facilitated significant growth in ticket sales and fundraising by making it possible for us to have a 360 degree view of everyone in our database.,
patronmanager,"The best software! Makes my job much easier, with its ease of use and dependability.",Jessica P.,Director of Ticketing Services,"Higher Education, 1001-5000 employees",Used the software for: 2+ years,NO,Source: Capterra,"Dec 22, 2017",5,5,5,5,5,10.0,,"Pros: Love that we can customize almost anything to meet our unique needs. Ease of reporting, either using pre-made reports that come built in, or by customizing our own for specific details. Features are constantly being added - a highlight of any month is reading through Release Notes! Because my department is so small, I have come to depend on PM to house institutional knowledge that would otherwise be lost if even one member of our team left the organization. Building and managing inventory could not be easier. Love that I can customize email templates - has made invoicing directly from PM so easy. Chatter makes communicating with our student staff a breeze, and I love that I am able to work from home using PatronManager when weather or school closings are an issue. Have wifi, will travel.","Cons: There definitely has to be someone on staff who can be an admin that is well versed in most of the smaller troubleshooting issues, so that you're not constantly relying on PM Support. However, the online training and help modules are so robust, that this is not a problem. There is always help available, either online, or through the fantastic client services department that handles support requests.",Overall: It has facilitated significant growth in ticket sales and fundraising by making it possible for us to have a 360 degree view of everyone in our database.,
patronmanager,"Using PatronManager has allowed us to integrate everything we do, despite having no central office.",Verified Reviewer,nan,Entertainment,Source: Capterra,NO,nan,"Jan 11, 2018",5,4,5,5,5,10.0,,"Pros: Truly an integrated CRM system that allows us to see what our members and non-members are doing. All-volunteer organization has some unique processes, and we have been able to customize PatronManager to accommodate our show attendance invitation system, for example. Also, because it's cloud-based and, once set up, most user procedures are fairly straight-forward, we've been able to decentralize a number of data management tasks. Committees manage their own data, rather than one database administrator (also volunteer) needing to be responsible for all collection and reporting. We also like the ability to clone donation forms (non-complex ones) ourselves, to customize them for specific purposes.","Cons: Developing reports is more challenging than many of our members can handle technically, so that remains largely the purview of a very small number of people (1-2). Implementation was generally smooth, despite some (inevitable) resistance to change. If there are multiple people qualifying donations and ticket orders, that process needs to be actively managed. Without active management, qualification can get a back-log, which (appropriately) results in temporary dupes in the system.",Overall: It has facilitated significant growth in ticket sales and fundraising by making it possible for us to have a 360 degree view of everyone in our database.,
patronmanager,Very robust CRM system perfect for Non-Profit Theatre Company,Keith R.,General Manager,,Used the software for: 2+ years,NO,Source: Capterra,"Jan 10, 2018",5,5,5,5,nan,nan,,"Pros: Patron Manager stores all of our ticketing and donor data in a single database which allows us to create reports and mailing lists from a single source rather than pulling records from multiple excel spreadsheets. Their customer service and online help is world class, and keeps getting better each year with additional webinars and added content. Their process for keeping the database 'clean' is very helpful and avoids the duplication of records. The product is stable. Downtime is almost non-existent - we've had perhaps 3 incidents over 5 years of not being able to access the database and even then it was for a very short period of time with minor-to-no impact to operations.","Cons: The only 'negative' about the product was during our initial setup. The ease of data import was over-hyped. Templates were provided but the brunt of the work had to be done by us. This was five years ago and I'm going to guess they have found processes to make it easier for their customers to import data. All of this said, once they received the templates populated with our data the database was set up correctly.",Overall: It has facilitated significant growth in ticket sales and fundraising by making it possible for us to have a 360 degree view of everyone in our database.,
patronmanager,Glad we made the change Glad we made the change to Patron Manager,Jeff F.,Communications Director,"Performing Arts, 11-50 employees",Used the software for: 2+ years,NO,Source: Capterra,"Jan 22, 2018",4,4,4,4,4,8.0,,Pros: We took a long time (three years) in exploring ticketing/fundraising CRM options knowing that the shift in systems was going to be a major change for our organization. We are so glad that we chose Patron Manager and Salesforce. It is truly a system that will grow as our organization grows (and it is helping us in that growth!). We now have access to information and data in ways that were not possible with our previous systems. The support team has been very helpful in solving problems and guiding us in different directions as we test the limits of what we want to do. Our team is fired up to utilize Patron Manager and Salesforce and are eager to learn more.,"Cons: Reporting can be a bit of a challenge as it requires some very specific thinking about how to find what you want to know. Even after using the product for several years, I still feel like I'm not fluent in reporting.",Overall: Easier access to data about our patrons. We can now make better fact-based data decisions rather than relying upon hunch.,
patronmanager,User-Friendly Functionality & Incredible Customer Support,Scott G.,Audience Services & Operations Manager,"Performing Arts, 1-10 employees",Used the software for: 2+ years,NO,Source: Capterra,"Dec 21, 2017",5,5,5,5,5,10.0,,"Pros: If you can send an email and/or use Facebook, you can master software platform of PatronManager! Not only are the functions laid out in an easy-to-use, organized fashion, but the visual aesthetic of the program itself makes it almost self-explanatory. And if you have any questions, simply visit the PatronManager Help tab, where you can find step-by-step how-to's on almost any PatronManager feature or ""Submit a Support Request.""","Cons: Although the ""Reports"" feature is quite robust, especially along with CRM Snapshot options, but the sorting ""Fields"" are not available for every report. (Work-arounds usually do the trick.)","Overall: Again, not only is it easy to use and nice to look at from a user perspective, but it also allows for remote access, which helps make it THE BEST ticketing software I've ever had the pleasure of using in all of my 10+ box office sales experience!",
patronmanager,350 delivered!,Michael S.,IT Applications ' Development Manager,201-500 employees,Used the software for: 2+ years,NO,Source: Capterra,"Jan 08, 2018",5,5,5,5,nan,nan,,"Pros: The team at PatronTechnology is knowledgeable, collaborative, and has even helped our IT department understand and use the salesforce.com platform in new ways. We implemented nearly four years ago now, and we have very much enjoyed continuing to grow with them. PM got us that much closer to a true 360-degree view of our patrons, donors, alumni, students, parents, listeners, employees, and volunteers. Plus, it's on the Salesforce platform which means it's secure, fast, and reliable, as well as scalable and configurable.","Cons: Honestly, there's not much to dislike. There are a few minor aspects that I wish were more configurable for our environment, but we have workarounds for them so not a large negative impact.","Overall: Again, not only is it easy to use and nice to look at from a user perspective, but it also allows for remote access, which helps make it THE BEST ticketing software I've ever had the pleasure of using in all of my 10+ box office sales experience!",
patronmanager,Great CRM solution for ticketing and development.,Michael W.,Operation Manager,,Used the software for: 2+ years,NO,Source: Capterra,"Dec 21, 2017",5,4,5,5,5,10.0,,"Pros: That it is a cloud-based CRM - it is wonderful to have our Ticket Sales, Donations History, and Marketing history all in one place. PatronManager has been able to help us do more and is very customize-able. CRM snapshots (easy way to run quick list like show me ticket buyers that came to X show but not bought tickets for Y show yet).",Cons: There is a learning curve in creating your own customized reports as the reporting structure is very robust. The payoff is worth the learning curve as you can create reports on just about anything. (There are canned reports and CRM Snapshots which are easy to use right off the bat.),Overall: It is fantastic,
patronmanager,PatronManager enables our small staff to thrive with CRM - so agile and efficient!,Emily H.,Co-Founder/Co-Director,,Used the software for: 2+ years,NO,Source: Capterra,"Jan 08, 2018",5,5,5,5,nan,nan,,"Pros: All information on donations, marketing, and ticketing is in one place! You can look at a person's PatronManager account and really see a snapshot of that patron's interactions with the Ballet...from their last ticket order to their recent meeting with the development team. So helpful, especially for our small staff!","Cons: Because the possibilities in Salesforce are so vast, things can be overwhelming upon first adoption for non-tech-minded people. The PM team helps you customize anything you want and the annual conferences in NYC are super helpful to see how other organizations and teams are using the Salesforce platform.",Overall: It is fantastic,
patronmanager,User with 3 years experience,Richard M.,Artistic Director,Music,Used the software for: 2+ years,NO,Source: Capterra,"Dec 20, 2017",5,4,4,5,5,10.0,,"Pros: This is an excellent, robust ticketing system that lets us run our entire company in Salesforce, the world's leading CRM. All our data are in one place!","Cons: PatronManager has a big impact on your Salesforce instance. It will be the signature feature governing how your CRM works. While sometimes you will find this to be good and helpful, at others you'll find it can complicate development of your own Salesforce customizations.","Overall: It lets us run our entire company in Salesforce, keeping all our data in one place!",
patronmanager,Can't love it enough.,David B.,Managing Director,,Used the software for: 1-2 years,NO,Source: Capterra,"Dec 20, 2017",5,4,5,5,5,10.0,,"Pros: Customization. If the software doesn't have what you need out of the box, they will build something custom for you (or you can build it yourself!) and they're always updating the software with new features to improve ease of use or give more powerful options.",Cons: You really do need an admin on the staff who will be in charge of maintaining the software from your side. That staff person should learn as much about the software as they can to troubleshoot minor problems in-house so you won't need their support system for small things.,Overall: We've seen immediate increases of both ticket sales AND donation revenue.,
patronmanager,Great for all aspects of our organization!,Dan M.,Guest Service Supervisor,,Used the software for: 2+ years,NO,Source: Capterra,"Dec 21, 2017",5,5,5,4,5,8.0,,Pros: The greatest thing is the flexibility to customize the software to suit your needs. This allows us to handle a number of different sales processes and keep looking for ways to improve how our organizations interactions with guests.,"Cons: Also the customization, since it really requires someone to take ownership of the system and can make support tricky since every business does things differently",Overall: We've seen immediate increases of both ticket sales AND donation revenue.,
patronmanager,I have enjoyed the past 4 years using PatronManager!,Evan V.,Box Office Manager,"Entertainment, 51-200 employees",Used the software for: 2+ years,NO,Source: Capterra,"Dec 22, 2017",5,4,5,5,5,10.0,,"Pros: Excellent support staff, in-depth training resources at your fingertips, robust reporting, and the ability to customize the system to meet your needs all adds up to a powerful CRM that I highly recommend.","Cons: It can be very daunting learning the reporting side of the system but once you have a firm grasp on the terminology and how reporting works, the system becomes very enjoyable to use.",Overall: We've seen immediate increases of both ticket sales AND donation revenue.,
patronmanager,PatronManager - A Comprehensive Solution for Ticket Sales and Donor Management,Robert J.,"Director, Townsend Center",,,nan,Source: Capterra,"Jan 08, 2015",5,4,nan,5,nan,nan,"Comments: The Townsend Center for the Performing Arts is now in its second season with PatronManager. The system is built on the SalesForce Platform, which is the leading CRM and database platform used by most of the Fortune 500 companies.","Pros: Excellent support staff, in-depth training resources at your fingertips, robust reporting, and the ability to customize the system to meet your needs all adds up to a powerful CRM that I highly recommend.","Cons: It can be very daunting learning the reporting side of the system but once you have a firm grasp on the terminology and how reporting works, the system becomes very enjoyable to use.",Overall: We've seen immediate increases of both ticket sales AND donation revenue.,
patronmanager,Great to have one database that gives us a complete picture of our customer,Lee Ann B.,Marketing & Public Relations Director/Group Sales Director,"Performing Arts, 11-50 employees",Used the software for: 2+ years,NO,Source: Capterra,"Dec 22, 2017",4,4,3,4,nan,nan,"Comments: The Townsend Center for the Performing Arts is now in its second season with PatronManager. The system is built on the SalesForce Platform, which is the leading CRM and database platform used by most of the Fortune 500 companies.","Pros: What we used to do in three databases and a couple of spreadsheets is now in one: ticket purchases, donations, volunteer experience, class registrations","Cons: The class registration ""module"" is the second or third app we've tried. It's good, but still not a seamless integration.",Overall: We've seen immediate increases of both ticket sales AND donation revenue.,
patronmanager,PatronManager Review,Joel N.,Data Analyst,"Information Technology and Services, 501-1000 employees",Review is based on a free trial,NGC,Source: Capterra,"May 29, 2019",5,4,4,5,4,9.0,"Comments: The Townsend Center for the Performing Arts is now in its second season with PatronManager. The system is built on the SalesForce Platform, which is the leading CRM and database platform used by most of the Fortune 500 companies.","Pros: Being a software that is all about donations, fundraising, ticket sales and anything that comes close to event revenue, I would really recommend it for it's reliability in boosting tickets sales and tracking every activity accordingly, accuracy and minimal human error, efficient booking and managing mails for campaigns or customer update.",Cons: Initial data set-up can be a bit of work depending on the industry you are based.,"Overall: It's an amazing tool that helps you out with managing funds that are generated from events. Whether fit's ticket sales, fundraisers or donations, you can always rely on the app. In fact, you get to enjoy remote access in case you happen to move around a lot.",
patronmanager,wait until you die to hear back from customer service....,monika L.,Director of Operations,"Motion Pictures and Film, 1-10 employees",Used the software for: 2+ years,NGC,Source: Capterra,"Jan 03, 2019",3,3,2,1,3,3.0,"Comments: The Townsend Center for the Performing Arts is now in its second season with PatronManager. The system is built on the SalesForce Platform, which is the leading CRM and database platform used by most of the Fortune 500 companies.",Pros: there are some nice features that makes some set ups easy and quick. it's great database. The reporting is endless.,"Cons: I have never seen such a bad customer service in my life. In many situations , I waited 2 months to get a response!!! usually it's weeks. I have complained many times, but the response was that we can pay for faster response time. Insane! This is my major problem with this product.

There are also some limitations due to Salesforce features, like confirmation e-mails that have very complicated HTML coding.",Overall: It's not an intuitive product and require a lot of effort to use it and learn it.,
patronmanager,Overall Patronmanager is a good product for the price. Great for mid-size organizations,Chase M.,Executive Director,"Music, 1-10 employees",Used the software for: 2+ years,NO,Source: Capterra,"Feb 08, 2018",4,4,3,3,4,8.0,"Comments: The Townsend Center for the Performing Arts is now in its second season with PatronManager. The system is built on the SalesForce Platform, which is the leading CRM and database platform used by most of the Fortune 500 companies.","Pros: It is web accesible, and once you figure out with tech support how to get it integrated to the look and feel of your own website, it provides a good patron experience.",Cons: Getting the right report is pretty difficult. There are not enough standard reports that are useful for us and we have found that many reports we need require a call to tech support to ask them to make it. Tech support is more responsive on email than on phone.,Overall: It's not an intuitive product and require a lot of effort to use it and learn it.,
patronmanager,Best in Class CRM Software!,Jeremy W.,Director Of Operations,Performing Arts,Used the software for: 6-12 months,NO,Source: Capterra,"Dec 21, 2017",5,3,4,2,nan,nan,"Comments: The Townsend Center for the Performing Arts is now in its second season with PatronManager. The system is built on the SalesForce Platform, which is the leading CRM and database platform used by most of the Fortune 500 companies.",Pros: Very robust and customize-able! Can configure the system to work with your specific operation and can do most of that yourself.,Cons: Takes too long for help desk to respond to questions/issues. Would like online chat to be able to get instant responses to quick questions.,Overall: It's not an intuitive product and require a lot of effort to use it and learn it.,
