oveit,"The power I bed in organising events, finally at hand",Florin G.,Founder,"Entertainment, 1-10 employees",Used the software for: 6-12 months,VR,Source: Capterra,"Jan 04, 2017",5,5,5,5,5,10.0,"Comments: I had the pleasure of working with Oveit team for almost two years, collaborating on several projects. The most important project was to implement the possibility of purchasing tickets online for our performances. I was impressed with Oveit teams ability to manage our requests and to adapt the software to our needs.","Pros: Easy setting the event and the prices.

Email marketing with the customers.

Direct payments.

Embed code.","Cons: The mobile application maysuffer some improvements. On iOS worked fine, on Android had some minor malfunctions.","Overall: I like to name Oveit ""The YouTube for event organizers"" because of the simplicity of the service and because I really think that Oveit will revolutionize this industry like YouTube did with video publishing and monetization.",Recommendations to other buyers: Buying tickets directly on Facebook Newsfeed.
oveit,Great for Philharmonic,Vlad M.,,,,VR,Source: Capterra,"Jan 09, 2017",5,5,5,5,5,10.0,"Comments: It is a good platform regarding the selling of on-line tickets. Easy to use and great for customers, also for promoting each and every event.","Pros: Easy setting the event and the prices.

Email marketing with the customers.

Direct payments.

Embed code.","Cons: The mobile application maysuffer some improvements. On iOS worked fine, on Android had some minor malfunctions.","Overall: I like to name Oveit ""The YouTube for event organizers"" because of the simplicity of the service and because I really think that Oveit will revolutionize this industry like YouTube did with video publishing and monetization.",Recommendations to other buyers: Buying tickets directly on Facebook Newsfeed.
oveit,My experience with OVE team,Pop C.,,,,VR,Source: Capterra,"Jan 18, 2017",5,5,5,4,5,10.0,"Comments: My experience with OVE team was and will be a good one! Profesional team, nice people, suportive and creativ one.","Pros: Easy setting the event and the prices.

Email marketing with the customers.

Direct payments.

Embed code.","Cons: The mobile application maysuffer some improvements. On iOS worked fine, on Android had some minor malfunctions.","Overall: I like to name Oveit ""The YouTube for event organizers"" because of the simplicity of the service and because I really think that Oveit will revolutionize this industry like YouTube did with video publishing and monetization.",Recommendations to other buyers: Buying tickets directly on Facebook Newsfeed.
oveit,Our partnership with Oveit was very smooth and effortless. We were very please with the end result,Leonor G.,Event Manager Assistant,,Used the software for: Less than 6 months,VR,Source: Capterra,"Jun 29, 2018",5,5,3,5,4,8.0,"Comments: My experience with OVE team was and will be a good one! Profesional team, nice people, suportive and creativ one.","Pros: The software made our registration process easier, more accurate and we were able to gather more reliable data about our event.",Cons: Still needs some improvements on customer gamification to make customer interact more with the app...,"Overall: I like to name Oveit ""The YouTube for event organizers"" because of the simplicity of the service and because I really think that Oveit will revolutionize this industry like YouTube did with video publishing and monetization.",Recommendations to other buyers: Buying tickets directly on Facebook Newsfeed.
oveit,OVEIT platform helped me organize easier and faster several MBA events at Bucharest Business School,Alin Valentin A.,Dean,"Education Management, 1001-5000 employees",Used the software for: 6-12 months,VR,Source: Capterra,"May 11, 2017",5,5,5,5,5,10.0,"Comments: My experience with OVE team was and will be a good one! Profesional team, nice people, suportive and creativ one.","Pros: - the ""embed"" feature that allows you to use your own website to get people registered

- the reports it generates",Cons: Still needs some improvements on customer gamification to make customer interact more with the app...,"Overall: - a friendly interface

- fast and easy events setup

- reports",Recommendations to other buyers: Buying tickets directly on Facebook Newsfeed.
oveit,I had a very good experience. the team is incredibly supportive and prompt.,Dan P.,Director and founder,"Arts and Crafts, 1-10 employees",Used the software for: Less than 6 months,VR,Source: Capterra,"May 17, 2017",5,5,5,5,5,10.0,"Comments: My experience with OVE team was and will be a good one! Profesional team, nice people, suportive and creativ one.",Pros: It is easy to use. You can easily change things after you have already your tickets on sale. I needed to mage some changes each day and the interface is really friendly.,Cons: .,Overall: financial,Recommendations to other buyers: Buying tickets directly on Facebook Newsfeed.
oveit,Event Management on Cloud,Verified Reviewer,Director and founder,"Entertainment, 11-50 employees",Source: Capterra,NGC,Source: Capterra,"Sep 11, 2018",5,5,5,5,5,10.0,"Comments: My experience with OVE team was and will be a good one! Profesional team, nice people, suportive and creativ one.",Pros: Easy to use and you can send bills to companies. Integrates with website.,Cons: Doesn't have a customized Thank You page.,Overall: financial,Recommendations to other buyers: Buying tickets directly on Facebook Newsfeed.
oveit,DAVA Festival,Sergiu A.,Enginner,"Events Services, 1-10 employees",Used the software for: Less than 6 months,VR,Source: Capterra,"Sep 17, 2018",5,5,5,5,5,10.0,"Comments: My experience with OVE team was and will be a good one! Profesional team, nice people, suportive and creativ one.","Pros: easy acces to all sales

centralization of data

simple usage of aplication",Cons: requiremnet of NFC was a little issue for vendors,Overall: will used again next year,Recommendations to other buyers: Buying tickets directly on Facebook Newsfeed.
oveit,The app was the best choice for the needs of the organisation: a dynamic management system of guests,Anamaria B.,Communicatios Manager,,Used the software for: Less than 6 months,VR,Source: Capterra,"May 12, 2017",5,5,5,5,5,10.0,"Comments: My experience with OVE team was and will be a good one! Profesional team, nice people, suportive and creativ one.","Pros: It allows us to create an event from scratch (for the seating, in particular) and manage the guests dynamically.",Cons: requiremnet of NFC was a little issue for vendors,Overall: will used again next year,Recommendations to other buyers: Buying tickets directly on Facebook Newsfeed.
oveit,RGDA - Cristina,Cristina B.,Project Manager,"Computer Games, 1-10 employees",Used the software for: Less than 6 months,VR,Source: Capterra,"Jan 04, 2017",5,4,5,5,5,9.0,"Comments: My experience with OVE team was and will be a good one! Profesional team, nice people, suportive and creativ one.",Pros: It's pretty easy to use.,"Cons: Not the software, but the process behind it...and by that I mean the contract we had to sign with Netopia too.",Overall: Great experience overall - points for the Customer Support part! You did a great job with this platform.,Recommendations to other buyers: Find a way to skip the Netopia part. :) You as a company sign an agreement with them if possible and just offer the client the full package.
