company,title,name,position,industry,usage,paid_status,source,date,total,ease,feature,support,value,recommend,comments,pros,cons,overall,recommendations to other buyers
oveit,All the features you need in one place!,Claudiu Petru C.,Marketing Director,"Transportation/Trucking/Railroad, 51-200 employees",Used the software for: 6-12 months,VRI,Source: Capterra,"Jan 11, 2017",5,5,5,5,5,10.0,,"Pros: - Exceeds requirements

- Outstanding performance

- Adaptability

- Cost Consciousness

- Business Ethics",,"Overall: We are very proud of our partnership with Oveit! When we say Oveit, we talk about people. People who really changes things and they do it in a positive way!",
oveit,Perfect event management platform for various types of events,Mihai M.,Campaign Manager,"Non-Profit Organization Management, 201-500 employees",Used the software for: 2+ years,VRI,Source: Capterra,"Jan 26, 2017",5,5,5,5,5,10.0,,"Pros: I love the versatility of the product. It can be applied to any sort of event: small events, medium events, or huge events. Oveit covers all the management needs that an event organizer has, as you can easily set up badges for the event, and have a complete and real-time access management. Another useful element is the embed function, which enables the event organizer to sell tickets directly from his website. This is very cost effective as a 3rd party ticket seller can be avoided. And one last thing... it's very easy to use. Big plus on that!","Cons: There are so many functions that sometimes you can mix them up, but any organizer can live with that con when you look at the many pros that Oveit has to offer.","Overall: I've used Oveit platform for the charity events organized for HOSPICE Casa Sperantei. We've sold tickets in a very smooth way and handled all the event infrastructure with just a couple of clicks. By using the embed system, we were able to sell tickets directly from the event homepage. Also, by collecting data from the people that purchased tickets, we were able to keep in contact with everyone, even after the event has ended.

For a charity that needs cost efficiency, Oveit was a perfect solution. The user experience for an organizer is great and it takes around 5 minutes to set up the event and get it going. Also, with just a couple of clicks to manage the whole event, manpower is reduced to minimum and because of Oveit, one man can do the job of many. Great job!","Recommendations to other buyers: Check out all the functions that Oveit has to offer and use them, as they will make your life easier."
oveit,"Great app, stellar customer support",Laura B.,Digital Marketing Specialist,"Internet, 11-50 employees",Used the software for: Less than 6 months,VRI,Source: Capterra,"Jan 09, 2017",5,5,5,5,5,9.0,,"Pros: The intuitive interface and simple setup, the easy access to your stats, all the features they keep adding, the stellar customer support.",Cons: The mobile app sometimes crashed during the check-in process.,"Overall: We have tried several event management systems for the conferences & workshops our NGO organizes (30 to 400 participants per event). We've used even some of the most praised apps out there. Trouble was that none of them was quite up to par with the set of features we needed (website embedding for the event registration form, customer vouchers, mobile app for check-in, payment integration and a couple more). Oveit came as an awesome surprise. Not only did they provide all the core functionality we sought for at the most reasonable price, they also went the extra mile for us more than once to help us set everything up and integrate with other services. We did find some small feature missing from their UX, but it was addressed real fast by the team. All or this with a cheerful tone in e-mails. They already have a good system, but it's clear that they are an Agile team that keeps improving. When you're looking for a top notch event management app that's great value for the money, Ctrl-D recommends Oveit!","Recommendations to other buyers: Do try it, it's a revelation!"
oveit,Absolutely the best ticketing system I've ever used. Best price and amazing customer service.,Mike C.,Founder,"Financial Services, 11-50 employees",Used the software for: 6-12 months,VR,Source: Capterra,"Nov 10, 2017",5,5,5,5,5,9.0,,Pros: It has more features than I ever dreamed of. Very easy setup. Any suggestion I sent to customer service was implemented within a day or so.,"Cons: I want to see the exact details of each order (type of ticket purchased, discount, and other details pertaining to that ticket) when I get individual email for each ticket purchases by one of my clients. Right now it requires integration with MailGun, which I don't use.","Overall: We have tried several event management systems for the conferences & workshops our NGO organizes (30 to 400 participants per event). We've used even some of the most praised apps out there. Trouble was that none of them was quite up to par with the set of features we needed (website embedding for the event registration form, customer vouchers, mobile app for check-in, payment integration and a couple more). Oveit came as an awesome surprise. Not only did they provide all the core functionality we sought for at the most reasonable price, they also went the extra mile for us more than once to help us set everything up and integrate with other services. We did find some small feature missing from their UX, but it was addressed real fast by the team. All or this with a cheerful tone in e-mails. They already have a good system, but it's clear that they are an Agile team that keeps improving. When you're looking for a top notch event management app that's great value for the money, Ctrl-D recommends Oveit!","Recommendations to other buyers: Do try it, it's a revelation!"
oveit,Excellent ease of use and support,Bogdan I.,Chairman,"E-Learning, 1-10 employees",Used the software for: 6-12 months,VR,Source: Capterra,"Nov 30, 2018",5,5,4,5,5,9.0,,"Pros: We have found Oveit to be easy to integrate, configure and use.",Cons: A few more features regarding reporting would be useful.,Overall: The overall experience was very positive and I would definitely recommend it.,"Recommendations to other buyers: Do try it, it's a revelation!"
oveit,Oveit's bespoke around the clock support made it possible!,Matt H.,,,,VR,Source: Capterra,"Jan 05, 2017",5,4,4,5,5,9.0,Comments: Without the support that Oveit's team offered the event would not have been possible. With a complex time slot management across a number of days as well as adhering to brand guidelines made it incredibly hard to find a plug and play solution.,"Pros: We have found Oveit to be easy to integrate, configure and use.",Cons: A few more features regarding reporting would be useful.,Overall: The overall experience was very positive and I would definitely recommend it.,"Recommendations to other buyers: Do try it, it's a revelation!"
oveit,Amazing software for event planners,Paula V.,Marketing Manager,"Fine Art, 51-200 employees",Used the software for: 1-2 years,VR,Source: Capterra,"Jan 11, 2017",5,5,5,5,5,10.0,Comments: Without the support that Oveit's team offered the event would not have been possible. With a complex time slot management across a number of days as well as adhering to brand guidelines made it incredibly hard to find a plug and play solution.,"Pros: You have full control on managing your event, no third party interference.",Cons: A few more features regarding reporting would be useful.,"Overall: I've used Oveit for more than a year and it never let me down. It has great features, such as making private events, 2 for 1 offers, embedding the link on your website and many more. I recommend it for anyone who needs to sell online tickets for an event.","Recommendations to other buyers: Do try it, it's a revelation!"
oveit,ove is a stable and responsive platform which can help any event organizer to save a lot of time,Lucian G.,Webmaster,"Non-Profit Organization Management, 501-1000 employees",Used the software for: Less than 6 months,VR,Source: Capterra,"May 17, 2017",5,5,4,5,5,10.0,Comments: Without the support that Oveit's team offered the event would not have been possible. With a complex time slot management across a number of days as well as adhering to brand guidelines made it incredibly hard to find a plug and play solution.,"Pros: - clean and very simple flow to create and publish and event

- real-time response of the website

- the mobile app for checkin",Cons: - maximmum number of spots per ticket-type cannot be allocated dinamically using a parameter of global-total number of participants per event,"Overall: I have saved days of work to implement on our website a reservation system for a big event and also, saved a lot of effort to make the integration with the payment gateway.","Recommendations to other buyers: Do try it, it's a revelation!"
oveit,When TEDxBucharest meets OVEit,Stefan A.,Sales Manager,"Events Services, 11-50 employees",Used the software for: 6-12 months,VR,Source: Capterra,"Jan 13, 2017",5,5,4,5,5,10.0,"Comments: We met by chance and our experience working together has been a real joy.

This platform has successfully passed our test by helping TEDxBucharest (one day event with over 900 attendees last year) reach out to people and spread ideas easier, faster and more simple.

The platform is very intuitive and user friendly, which makes the event set-up seem like a piece of cake.

Extra points for the integrated seating map, for the registration process and for the friendly technical support that OVEit team offers.

Great job guys!","Pros: - clean and very simple flow to create and publish and event

- real-time response of the website

- the mobile app for checkin",Cons: - maximmum number of spots per ticket-type cannot be allocated dinamically using a parameter of global-total number of participants per event,"Overall: I have saved days of work to implement on our website a reservation system for a big event and also, saved a lot of effort to make the integration with the payment gateway.","Recommendations to other buyers: Do try it, it's a revelation!"
oveit,"very easy to use, intuitive and fast enough to implement projects",Verified Reviewer,Sales Manager,,Source: Capterra,VR,Source: Capterra,"Nov 08, 2017",4,5,4,4,5,10.0,"Comments: We met by chance and our experience working together has been a real joy.

This platform has successfully passed our test by helping TEDxBucharest (one day event with over 900 attendees last year) reach out to people and spread ideas easier, faster and more simple.

The platform is very intuitive and user friendly, which makes the event set-up seem like a piece of cake.

Extra points for the integrated seating map, for the registration process and for the friendly technical support that OVEit team offers.

Great job guys!","Pros: ease of use

friendly interface

intuitive project setting process

some customizable, useful aspects that are not found in other event software

the fast settlement system","Cons: is not very adaptable to more complex projects

developments and software improvements sometimes take longer than expected",Overall: the speed at which you can set an event,"Recommendations to other buyers: Do try it, it's a revelation!"
oveit,Excellent service and really easy to integrate,Peter C.,CEO,"Information Technology and Services, 1-10 employees",Used the software for: Less than 6 months,VR,Source: Capterra,"Jul 23, 2017",5,5,5,5,5,8.0,"Comments: We met by chance and our experience working together has been a real joy.

This platform has successfully passed our test by helping TEDxBucharest (one day event with over 900 attendees last year) reach out to people and spread ideas easier, faster and more simple.

The platform is very intuitive and user friendly, which makes the event set-up seem like a piece of cake.

Extra points for the integrated seating map, for the registration process and for the friendly technical support that OVEit team offers.

Great job guys!",Pros: the simplicity and customer care of oveit is fantastic. It is the easiest tool by far for ticketing to integrate to your site,Cons: there is nothing at all about that I dislike about oveit. It has reached all my expectations. I would definitely recommend it.,Overall: the speed at which you can set an event,"Recommendations to other buyers: Do try it, it's a revelation!"
oveit,Ticketing Events for The New Era,Gheorghe C.,Managing Partner,"Sports, 1-10 employees",Used the software for: 2+ years,VR,Source: Capterra,"Jan 05, 2017",5,3,4,5,5,10.0,"Comments: We met by chance and our experience working together has been a real joy.

This platform has successfully passed our test by helping TEDxBucharest (one day event with over 900 attendees last year) reach out to people and spread ideas easier, faster and more simple.

The platform is very intuitive and user friendly, which makes the event set-up seem like a piece of cake.

Extra points for the integrated seating map, for the registration process and for the friendly technical support that OVEit team offers.

Great job guys!","Pros: - simple after you learn to use it;

- it's taking a lot of things from your list;","Cons: - it must be linked with the social accounts of the clients;

- it can provide also a feedback after the event from the clients","Overall: I am working with OVERT for 2 years, it's very helpful resources.

Nice Job for the team, easy to work with it!","Recommendations to other buyers: Do try it, it's a revelation!"
oveit,Overall experience,Adriana B.,SAM,"Public Relations and Communications, 11-50 employees",Used the software for: 6-12 months,VR,Source: Capterra,"Nov 29, 2018",5,5,4,5,5,10.0,"Comments: We met by chance and our experience working together has been a real joy.

This platform has successfully passed our test by helping TEDxBucharest (one day event with over 900 attendees last year) reach out to people and spread ideas easier, faster and more simple.

The platform is very intuitive and user friendly, which makes the event set-up seem like a piece of cake.

Extra points for the integrated seating map, for the registration process and for the friendly technical support that OVEit team offers.

Great job guys!","Pros: Really intuitive back-end, easy to extract data and reports, reliable - it never stopped working propperly","Cons: actually, there are no cons. It was for the first time we worked with the platform and it just has been the best so far experience and far better then previous platforms that we used for our events.","Overall: I am working with OVERT for 2 years, it's very helpful resources.

Nice Job for the team, easy to work with it!","Recommendations to other buyers: Do try it, it's a revelation!"
oveit,"Great experience so far, the best self-service ticketing platform we've used so far.",Victor B.,Manager,"Entertainment, 1-10 employees",Used the software for: Less than 6 months,VR,Source: Capterra,"May 11, 2017",4,5,4,5,5,10.0,"Comments: We met by chance and our experience working together has been a real joy.

This platform has successfully passed our test by helping TEDxBucharest (one day event with over 900 attendees last year) reach out to people and spread ideas easier, faster and more simple.

The platform is very intuitive and user friendly, which makes the event set-up seem like a piece of cake.

Extra points for the integrated seating map, for the registration process and for the friendly technical support that OVEit team offers.

Great job guys!","Pros: Very user friendly, advanced statistics, good connectivity to PayPal, possibility to create and edit maps easily.","Cons: Only one payments processor available - PayPal, doesn't offer the option to print tickets and sell them offline.","Overall: I am working with OVERT for 2 years, it's very helpful resources.

Nice Job for the team, easy to work with it!","Recommendations to other buyers: Do try it, it's a revelation!"
oveit,Always in control,ionut b.,Editor In Chief,"Publishing, 11-50 employees",Used the software for: 2+ years,VR,Source: Capterra,"Jan 05, 2017",5,5,5,5,5,9.0,"Comments: We are organizing +20 events/year so event management is a key component for us. We used Oveit for some of our most important events and were delighted with the results. Intuitive, integration with our website and SM channels worked seamlessly and we were always in control of every detail. Also, the team at Oveit provided support whenever we need it.","Pros: Very user friendly, advanced statistics, good connectivity to PayPal, possibility to create and edit maps easily.","Cons: Only one payments processor available - PayPal, doesn't offer the option to print tickets and sell them offline.","Overall: I am working with OVERT for 2 years, it's very helpful resources.

Nice Job for the team, easy to work with it!","Recommendations to other buyers: Do try it, it's a revelation!"
oveit,"Great value for money, easy interface",Andreea P.,Executive Director,"Information Technology and Services, 1-10 employees",Used the software for: Less than 6 months,VR,Source: Capterra,"Jan 04, 2017",4,5,3,2,5,9.0,"Comments: We are organizing +20 events/year so event management is a key component for us. We used Oveit for some of our most important events and were delighted with the results. Intuitive, integration with our website and SM channels worked seamlessly and we were always in control of every detail. Also, the team at Oveit provided support whenever we need it.","Pros: easy to use, good value, functionality",Cons: customer care with delays,"Overall: Very good value for money, it has a very good admin interface that is easy to use and offers many functionalities. Sometimes, I felt the customer support was not as fast as I would have needed it to be. you need to grow your team :)","Recommendations to other buyers: Do try it, it's a revelation!"
oveit,Using Ove for the first time was great as it was so much easier to use than other platforms.,Ciprian S.,Founder,"Events Services, Self-employed",Used the software for: 6-12 months,VR,Source: Capterra,"Aug 03, 2017",5,5,5,5,5,9.0,"Comments: We are organizing +20 events/year so event management is a key component for us. We used Oveit for some of our most important events and were delighted with the results. Intuitive, integration with our website and SM channels worked seamlessly and we were always in control of every detail. Also, the team at Oveit provided support whenever we need it.","Pros: The fact the it is very easy to use and that you can send bills to companies, as well as the versatility on websites.",Cons: Perhaps the graphics of the website.,"Overall: Very good value for money, it has a very good admin interface that is easy to use and offers many functionalities. Sometimes, I felt the customer support was not as fast as I would have needed it to be. you need to grow your team :)","Recommendations to other buyers: Do try it, it's a revelation!"
oveit,"quick uptake and easy customization, mobile site and access was impeccable, support was top notch !!",Townson T.,online ticket sales,,Used the software for: Less than 6 months,VR,Source: Capterra,"Jul 17, 2018",5,5,5,5,5,10.0,"Comments: We are organizing +20 events/year so event management is a key component for us. We used Oveit for some of our most important events and were delighted with the results. Intuitive, integration with our website and SM channels worked seamlessly and we were always in control of every detail. Also, the team at Oveit provided support whenever we need it.",Pros: Ability to search using multiple inputs to find purchase. Ease of refund and flexibility for orders. Easy to upscale or downscale quickly. Very quick to master the software and the documentation for billing purposes was very good. Pricing was excellent and paypal link was very easy.,Cons: No cons other than that it was our first time using so we had to make changes often before we could go live with the ticket sale.,Overall: saved time by not having to assign seats and allowed patrons to choose their seats,"Recommendations to other buyers: Do try it, it's a revelation!"
oveit,Easy to buy tickets online,Gabriel C.,,,,VR,Source: Capterra,"Jan 09, 2017",4,5,4,5,5,10.0,"Comments: I had the pleasure of working with Oveit team for almost two years, collaborating on several projects. The most important project was to implement the possibility of purchasing tickets online for our performances. I was impressed with Oveit teams ability to manage our requests and to adapt the software to our needs.",Pros: Ability to search using multiple inputs to find purchase. Ease of refund and flexibility for orders. Easy to upscale or downscale quickly. Very quick to master the software and the documentation for billing purposes was very good. Pricing was excellent and paypal link was very easy.,Cons: No cons other than that it was our first time using so we had to make changes often before we could go live with the ticket sale.,Overall: saved time by not having to assign seats and allowed patrons to choose their seats,"Recommendations to other buyers: Do try it, it's a revelation!"
oveit,It is a very helpful tool to start selling ticket for your event with a lot of helpful options.,vasile H.,Digital Manager,"Entertainment, 201-500 employees",Used the software for: Less than 6 months,VR,Source: Capterra,"Jul 26, 2017",4,4,4,5,4,9.0,"Comments: I had the pleasure of working with Oveit team for almost two years, collaborating on several projects. The most important project was to implement the possibility of purchasing tickets online for our performances. I was impressed with Oveit teams ability to manage our requests and to adapt the software to our needs.","Pros: Possibility to add vouchers ( discount or valie), to add different scheduled types of tickets, options to display on your page, easy script to embed in your website.","Cons: doesn't have a customized Thank you page ( to use in Analytics conversions), mobile application is quite simple , just to scan ticket; I hope they will add in the future similar functions as they have on website.",Overall: Easy to sell tickets for our festival.,"Recommendations to other buyers: Do try it, it's a revelation!"
oveit,"A learning by doing experience, made possible by the great customer support at Oveit.",Iustina N.,Fundraiser,,,VR,Source: Capterra,"May 11, 2017",5,4,4,5,4,9.0,"Comments: I had the pleasure of working with Oveit team for almost two years, collaborating on several projects. The most important project was to implement the possibility of purchasing tickets online for our performances. I was impressed with Oveit teams ability to manage our requests and to adapt the software to our needs.","Pros: Intuitive platform, multiple functions and options one can customise based on needs.

Highly responsive customer support, user oriented and open to accommodate specific needs.","Cons: doesn't have a customized Thank you page ( to use in Analytics conversions), mobile application is quite simple , just to scan ticket; I hope they will add in the future similar functions as they have on website.",Overall: Easy to sell tickets for our festival.,"Recommendations to other buyers: Do try it, it's a revelation!"
oveit,Implementing Oveit into my site was very simple,Mike O.,Developer,"Staffing and Recruiting, 11-50 employees",Used the software for: Less than 6 months,VR,Source: Capterra,"Jul 18, 2017",4,4,3,5,4,7.0,"Comments: I had the pleasure of working with Oveit team for almost two years, collaborating on several projects. The most important project was to implement the possibility of purchasing tickets online for our performances. I was impressed with Oveit teams ability to manage our requests and to adapt the software to our needs.",Pros: Building an event and adding it to my site. This was simple and I liked being able to customize the color.,"Cons: Unable to view statistics on the mobile app. Also being able to purchase tickets was removed during the event, this was mainly my fault but the time is in 24 hour and not 12. I thought I had set the event to 7pm but ability to purchase tickets ended at 2.",Overall: Easy to sell tickets for our festival.,"Recommendations to other buyers: Do try it, it's a revelation!"
oveit,A very nice experience. An excellent ticket management tool.,Florin T.,Member,"Non-Profit Organization Management, 11-50 employees",Used the software for: Less than 6 months,VR,Source: Capterra,"May 18, 2017",5,5,5,5,5,10.0,"Comments: I had the pleasure of working with Oveit team for almost two years, collaborating on several projects. The most important project was to implement the possibility of purchasing tickets online for our performances. I was impressed with Oveit teams ability to manage our requests and to adapt the software to our needs.","Pros: A very useful, responsive, and user-friendly platform. Permanent support from the developers. An excellent price-quality deal. Recommended for all kind of events.","Cons: The mobile application maysuffer some improvements. On iOS worked fine, on Android had some minor malfunctions.",Overall: Excellent overview about the event; Real-time feedback about the sales; extremely concise reporting facilities.,"Recommendations to other buyers: Do try it, it's a revelation!"
